year,rank,candidateRank,selectionRank,importanceScore,importanceReasons,paperId,title,authors,venue,publicationDate,citationCount,influentialCitationCount,category,abstract,doi,arxiv,pubmed,url,semanticScholarUrl,openAccessPdf,fieldsOfStudy,candidate,githubUrl
2012,20,,20,169.134,citations=186; influential=8; recognized venue; BCI term matches=1; title BCI matches=1; open PDF metadata,950410dfa2612f31bc2f0dd047838c0d2c71aaa7,Autocalibration and Recurrent Adaptation: Towards a Plug and Play Online ERD-BCI,"J. Faller, C. Vidaurre, T. Solis-Escalante, C. Neuper, Reinhold Scherer",IEEE transactions on neural systems and rehabilitation engineering,2012-04-03,186,8,General BCI Methods and Systems,,10.1109/TNSRE.2012.2189584,,22481835,https://doi.org/10.1109/TNSRE.2012.2189584,https://www.semanticscholar.org/paper/950410dfa2612f31bc2f0dd047838c0d2c71aaa7,,Computer Science; Engineering; Medicine,False,
2012,21,,21,174.987,citations=184; influential=21; BCI term matches=1; title BCI matches=1; open PDF metadata,b3540e217ed3365fac48781bfd9769bb645a7a71,On the Feasibility of Side-Channel Attacks with Brain-Computer Interfaces,"I. Martinovic, Doug Davies, Mario Frank, Daniele Perito, T. Ros, D. Song",USENIX Security Symposium,2012-08-08,184,21,General BCI Methods and Systems,,,,,https://www.semanticscholar.org/paper/b3540e217ed3365fac48781bfd9769bb645a7a71,https://www.semanticscholar.org/paper/b3540e217ed3365fac48781bfd9769bb645a7a71,,Computer Science; Engineering,False,
2012,22,,22,171.351,citations=178; influential=11; clinical/rehab relevance; BCI term matches=3; title BCI matches=1; open PDF metadata,8212f78cce29b49d36b5b0048f373e2bd0ebb940,Brain-computer interface controlled robotic gait orthosis,"An H. Do, Po T. Wang, Christine E. King, S. Chun, Z. Nenadic",Journal of NeuroEngineering and Rehabilitation,2012-08-24,178,11,Motor Imagery and Movement Decoding,"Excessive reliance on wheelchairs in individuals with tetraplegia or paraplegia due to spinal cord injury (SCI) leads to many medical co-morbidities, such as cardiovascular disease, metabolic derangements, osteoporosis, and pressure ulcers. Treatment of these conditions contributes to the majority of SCI health care costs. Restoring able-body-like ambulation in this patient population can potentially reduce the incidence of these medical co-morbidities, in addition to increasing independence and quality of life. However, no biomedical solution exists that can reverse this loss of neurological function, and hence novel methods are needed. Brain-computer interface (BCI) controlled lower extremity prostheses may constitute one such novel approach. One able-bodied subject and one subject with paraplegia due to SCI underwent electroencephalogram (EEG) recordings while engaged in alternating epochs of idling and walking kinesthetic motor imagery (KMI). These data were analyzed to generate an EEG prediction model for online BCI operation. A commercial robotic gait orthosis (RoGO) system (suspended over a treadmill) was interfaced with the BCI computer to allow for computerized control. The subjects were then tasked to perform five, 5-min-long online sessions where they ambulated using the BCI-RoGO system as prompted by computerized cues. The performance of this system was assessed with cross-correlation analysis, and omission and false alarm rates. The offline accuracy of the EEG prediction model averaged 86.30% across both subjects (chance: 50%). The cross-correlation between instructional cues and the BCI-RoGO walking epochs averaged across all subjects and all sessions was 0.812±0.048 (p-value <10−4). Also, there were on average 0.8 false alarms per session and no omissions. These results provide preliminary evidence that restoring brain-controlled ambulation after SCI is feasible. Future work will test the function of this system in a population of subjects with SCI. If successful, this may justify the future development of BCI-controlled lower extremity prostheses for free overground walking for those with complete motor SCI. Finally, this system can also be applied to incomplete motor SCI, where it could lead to improved neurological outcomes beyond those of standard physiotherapy.",10.1186/1743-0003-10-111,1208.5024,24321081,https://doi.org/10.1186/1743-0003-10-111,https://www.semanticscholar.org/paper/8212f78cce29b49d36b5b0048f373e2bd0ebb940,https://jneuroengrehab.biomedcentral.com/counter/pdf/10.1186/1743-0003-10-111,Computer Science; Engineering; Medicine,False,
2012,23,,23,179.544,citations=176; influential=12; recognized venue; invasive/high-bandwidth BCI; BCI term matches=1; title BCI matches=1; open PDF metadata,94fa0c47060ce531e74eb8e43e49bef956a744ab,A recurrent neural network for closed-loop intracortical brain–machine interface decoders,"David Sussillo, Paul Nuyujukian, Joline M. Fan, J. Kao, S. Stavisky, S. Ryu, et al.",Journal of Neural Engineering,2012-03-19,176,12,Invasive and Implantable Interfaces,,10.1088/1741-2560/9/2/026027,,22427488,https://doi.org/10.1088/1741-2560/9/2/026027,https://www.semanticscholar.org/paper/94fa0c47060ce531e74eb8e43e49bef956a744ab,https://europepmc.org/articles/pmc3638090?pdf=render,Computer Science; Engineering; Medicine; Physics,False,
2012,24,,24,168.402,citations=176; influential=6; recognized venue; BCI term matches=3; title BCI matches=2; open PDF metadata,0c25a428479b47ae45e072493a760eed79be6c2f,How Many People Could Use an SSVEP BCI?,"C. Guger, B. Allison, Bernhard Großwindhager, R. Prückl, C. Hintermüller, C. Kapeller, et al.",Frontiers in Neuroscience,2012-11-19,176,6,Motor Imagery and Movement Decoding,"Brain-computer interfaces (BCI) are communication systems that allow people to send messages or commands without movement. BCIs rely on different types of signals in the electroencephalogram (EEG), typically P300s, steady-state visually evoked potentials (SSVEP), or event-related desynchronization. Early BCI systems were often evaluated with a selected group of subjects. Also, many articles do not mention data from subjects who performed poorly. These and other factors have made it difficult to estimate how many people could use different BCIs. The present study explored how many subjects could use an SSVEP BCI. We recorded data from 53 subjects while they participated in 1–4 runs that were each 4 min long. During these runs, the subjects focused on one of four LEDs that each flickered at a different frequency. The eight channel EEG data were analyzed with a minimum energy parameter estimation algorithm and classified with linear discriminant analysis into one of the four classes. Online results showed that SSVEP BCIs could provide effective communication for all 53 subjects, resulting in a grand average accuracy of 95.5%. About 96.2% of the subjects reached an accuracy above 80%, and nobody was below 60%. This study showed that SSVEP based BCI systems can reach very high accuracies after only a very short training period. The SSVEP approach worked for all participating subjects, who attained accuracy well above chance level. This is important because it shows that SSVEP BCIs could provide communication for some users when other approaches might not work for them.",10.3389/fnins.2012.00169,,23181009,https://doi.org/10.3389/fnins.2012.00169,https://www.semanticscholar.org/paper/0c25a428479b47ae45e072493a760eed79be6c2f,https://www.frontiersin.org/articles/10.3389/fnins.2012.00169/pdf,Computer Science; Medicine,False,
2012,25,,25,169.617,citations=172; influential=14; BCI term matches=3; title BCI matches=1; open PDF metadata,3236c3ea1df452999464c04e749f6287f24a3230,Objective and Subjective Evaluation of Online Error Correction during P300-Based Spelling,"M. Perrin, E. Maby, S. Daligault, O. Bertrand, J. Mattout",Adv. Hum. Comput. Interact.,,172,14,"SSVEP, P300, and ERP Spellers","Error potentials (ErrP) are alterations of EEG traces following the subject's perception of erroneous feedbacks. They provide a way to recognize misinterpreted commands in brain-computer interfaces (BCI). However, this has been evaluated online in only a couple of studies and mostly with very few subjects. In this study, we implemented a P300-based BCI, including not only online error detection but also, for the first time, automatic correction. We evaluated it in 16 healthy volunteers. Whenever an error was detected, a new decision was made based on the second best guess of a probabilistic classifier. At the group level, correction did neither improve nor deteriorate spelling accuracy. However, automatic correction yielded a higher bit rate than a respelling strategy. Furthermore, the fine examination of interindividual differences in the efficiency of error correction and spelling clearly distinguished between two groups who differed according to individual specificity in ErrP detection. The high specificity group had larger evoked responses and made fewer errors which were corrected more efficiently, yielding a 4% improvement in spelling accuracy and a higher bit rate. Altogether, our results suggest that the more the subject is engaged into the task, the more useful and well accepted the automatic error correction.",10.1155/2012/578295,,,https://doi.org/10.1155/2012/578295,https://www.semanticscholar.org/paper/3236c3ea1df452999464c04e749f6287f24a3230,https://downloads.hindawi.com/journals/ahci/2012/578295.pdf,Computer Science,False,
2012,26,,26,170.408,citations=168; influential=8; review/survey; clinical/rehab relevance; BCI term matches=2; title BCI matches=1; open PDF metadata,86fa32b5f6bd33886c5c904cc6705675624e2f50,On the feasibility of using motor imagery EEG-based brain–computer interface in chronic tetraplegics for assistive robotic arm control: a clinical test and long-term post-trial follow-up,"G. Onose, C. Grozea, A. Anghelescu, C. Daia, C. Sinescu, A. V. Ciurea, et al.",Spinal Cord,2012-03-13,168,8,Motor Imagery and Movement Decoding,"Study design:Survey and long-term clinical post-trial follow-up (interviews/correspondence) on nine chronic, post spinal cord injury (SCI) tetraplegics.Objective:To assess feasibility of the use of Electroencephalography-based Brain–Computer Interface (EEG–BCI) for reaching/grasping assistance in tetraplegics, through a robotic arm.Settings:Physical and (neuromuscular) Rehabilitation Medicine, Cardiology, Neurosurgery Clinic Divisions of TEHBA and UMPCD, in collaboration with ‘Brain2Robot’ (composed of the European Commission-funded Marie Curie Excellence Team by the same name, hosted by Fraunhofer Institute-FIRST), in the second part of 2008.Methods:Enrolled patients underwent EEG–BCI preliminary training and robot control sessions. Statistics entailed multiple linear regressions and cluster analysis. A follow-up—custom questionnaire based—including patients’ perception of their EEG–BCI control capacity was continued up to 14 months after initial experiments.Results:EEG–BCI performance/calibration-phase classification accuracy averaged 81.0%; feedback training sessions averaged 70.5% accuracy for 7 subjects who completed at least one feedback training session; 7 (77.7%) of 9 subjects reported having felt control of the cursor; and 3 (33.3%) subjects felt that they were also controlling the robot through their movement imagination. No significant side effects occurred. BCI performance was positively correlated with beta (13–30 Hz) EEG spectral power density (coefficient 0.432, standardized coefficient 0.745, P-value=0.025); another possible influence was sensory AIS score (range: 0 min to 224 max, coefficient −0.177, standardized coefficient −0.512, P=0.089).Conclusion:Limited but real potential for self-assistance in chronic tetraplegics by EEG–BCI-actuated mechatronic devices was found, which was mainly related to spectral density in the beta range positively (increasing therewith) and to AIS sensory score negatively.",10.1038/sc.2012.14,,22410845,https://doi.org/10.1038/sc.2012.14,https://www.semanticscholar.org/paper/86fa32b5f6bd33886c5c904cc6705675624e2f50,https://www.nature.com/articles/sc201214.pdf,Engineering; Medicine,False,
2012,27,,27,155.934,citations=165; influential=4; recognized venue; BCI term matches=1; title BCI matches=1; open PDF metadata,57cee48fd95a4d74bd12b2d95b9e0a8679d09252,A novel BCI based on ERP components sensitive to configural processing of human faces,"Yu Zhang, Qibin Zhao, Jing Jin, Xingyu Wang, A. Cichocki",Journal of Neural Engineering,2012-04-01,165,4,"SSVEP, P300, and ERP Spellers",,10.1088/1741-2560/9/2/026018,,22414683,https://doi.org/10.1088/1741-2560/9/2/026018,https://www.semanticscholar.org/paper/57cee48fd95a4d74bd12b2d95b9e0a8679d09252,,Computer Science; Medicine; Physics; Psychology,False,
2012,28,,28,158.009,citations=162; influential=9; BCI term matches=1; title BCI matches=1; open PDF metadata,c5e438122091ebcae8d7b88b4f49c0bedf9d30ac,Combining BCI with Virtual Reality: Towards New Applications and Improved BCI,"F. Lotte, J. Faller, C. Guger, Yann Renard, G. Pfurtscheller, A. Lécuyer, et al.",,,162,9,General BCI Methods and Systems,,10.1007/978-3-642-29746-5_10,,,https://doi.org/10.1007/978-3-642-29746-5_10,https://www.semanticscholar.org/paper/c5e438122091ebcae8d7b88b4f49c0bedf9d30ac,,Computer Science; Engineering,False,
2012,29,,29,157.768,citations=158; influential=5; dataset/benchmark; invasive/high-bandwidth BCI; BCI term matches=2; open PDF metadata,f3a50dcf626142562bf1d369d8d9a4abdd70077d,Channel selection and classification of electroencephalogram signals: An artificial neural network and genetic algorithm-based approach,"Jianhua Yang, Harsimrat Singh, E. Hines, F. Schlaghecken, D. Iliescu, M. Leeson, et al.",Artif. Intell. Medicine,2012-06-01,158,5,Motor Imagery and Movement Decoding,"OBJECTIVE An electroencephalogram-based (EEG-based) brain-computer-interface (BCI) provides a new communication channel between the human brain and a computer. Amongst the various available techniques, artificial neural networks (ANNs) are well established in BCI research and have numerous successful applications. However, one of the drawbacks of conventional ANNs is the lack of an explicit input optimization mechanism. In addition, results of ANN learning are usually not easily interpretable. In this paper, we have applied an ANN-based method, the genetic neural mathematic method (GNMM), to two EEG channel selection and classification problems, aiming to address the issues above. METHODS AND MATERIALS Pre-processing steps include: least-square (LS) approximation to determine the overall signal increase/decrease rate; locally weighted polynomial regression (Loess) and fast Fourier transform (FFT) to smooth the signals to determine the signal strength and variations. The GNMM method consists of three successive steps: (1) a genetic algorithm-based (GA-based) input selection process; (2) multi-layer perceptron-based (MLP-based) modelling; and (3) rule extraction based upon successful training. The fitness function used in the GA is the training error when an MLP is trained for a limited number of epochs. By averaging the appearance of a particular channel in the winning chromosome over several runs, we were able to minimize the error due to randomness and to obtain an energy distribution around the scalp. In the second step, a threshold was used to select a subset of channels to be fed into an MLP, which performed modelling with a large number of iterations, thus fine-tuning the input/output relationship. Upon successful training, neurons in the input layer are divided into four sub-spaces to produce if-then rules (step 3). Two datasets were used as case studies to perform three classifications. The first data were electrocorticography (ECoG) recordings that have been used in the BCI competition III. The data belonged to two categories, imagined movements of either a finger or the tongue. The data were recorded using an 8 × 8 ECoG platinum electrode grid at a sampling rate of 1000 Hz for a total of 378 trials. The second dataset consisted of a 32-channel, 256 Hz EEG recording of 960 trials where participants had to execute a left- or right-hand button-press in response to left- or right-pointing arrow stimuli. The data were used to classify correct/incorrect responses and left/right hand movements. RESULTS For the first dataset, 100 samples were reserved for testing, and those remaining were for training and validation with a ratio of 90%:10% using K-fold cross-validation. Using the top 10 channels selected by GNMM, we achieved a classification accuracy of 0.80 ± 0.04 for the testing dataset, which compares favourably with results reported in the literature. For the second case, we performed multi-time-windows pre-processing over a single trial. By selecting 6 channels out of 32, we were able to achieve a classification accuracy of about 0.86 for the response correctness classification and 0.82 for the actual responding hand classification, respectively. Furthermore, 139 regression rules were identified after training was completed. CONCLUSIONS We demonstrate that GNMM is able to perform effective channel selections/reductions, which not only reduces the difficulty of data collection, but also greatly improves the generalization of the classifier. An important step that affects the effectiveness of GNMM is the pre-processing method. In this paper, we also highlight the importance of choosing an appropriate time window position.",10.1016/j.artmed.2012.02.001,,22503644,https://doi.org/10.1016/j.artmed.2012.02.001,https://www.semanticscholar.org/paper/f3a50dcf626142562bf1d369d8d9a4abdd70077d,https://doi.org/10.1016/j.artmed.2012.02.001,Computer Science; Medicine,False,
2012,30,,30,159.972,citations=151; influential=9; BCI term matches=2; title BCI matches=2; open PDF metadata,1b9cfdfa03a6d66d6747bd4f028fb6efcc1c3d72,Online use of error-related potentials in healthy users and people with severe motor impairment increases performance of a P300-BCI.,"M. Spüler, M. Bensch, S. Kleih, W. Rosenstiel, M. Bogdan, A. Kübler",Clinical Neurophysiology,2012-07-01,151,9,Motor Imagery and Movement Decoding,,10.1016/j.clinph.2011.11.082,,22244309,https://doi.org/10.1016/j.clinph.2011.11.082,https://www.semanticscholar.org/paper/1b9cfdfa03a6d66d6747bd4f028fb6efcc1c3d72,,Computer Science; Medicine,False,
2012,31,,31,166.113,citations=142; influential=7; recognized venue; BCI term matches=3; title BCI matches=2; open PDF metadata,8f364a5a188401aaa6b598fd427fafd1e57f1279,"The Changing Face of P300 BCIs: A Comparison of Stimulus Changes in a P300 BCI Involving Faces, Emotion, and Movement","Jing Jin, B. Allison, T. Kaufmann, A. Kübler, Yu Zhang, Xingyu Wang, et al.",PLoS ONE,2012-11-26,142,7,Motor Imagery and Movement Decoding,"Background One of the most common types of brain-computer interfaces (BCIs) is called a P300 BCI, since it relies on the P300 and other event-related potentials (ERPs). In the canonical P300 BCI approach, items on a monitor flash briefly to elicit the necessary ERPs. Very recent work has shown that this approach may yield lower performance than alternate paradigms in which the items do not flash but instead change in other ways, such as moving, changing colour or changing to characters overlaid with faces. Methodology/Principal Findings The present study sought to extend this research direction by parametrically comparing different ways to change items in a P300 BCI. Healthy subjects used a P300 BCI across six different conditions. Three conditions were similar to our prior work, providing the first direct comparison of characters flashing, moving, and changing to faces. Three new conditions also explored facial motion and emotional expression. The six conditions were compared across objective measures such as classification accuracy and bit rate as well as subjective measures such as perceived difficulty. In line with recent studies, our results indicated that the character flash condition resulted in the lowest accuracy and bit rate. All four face conditions (mean accuracy >91%) yielded significantly better performance than the flash condition (mean accuracy = 75%). Conclusions/Significance Objective results reaffirmed that the face paradigm is superior to the canonical flash approach that has dominated P300 BCIs for over 20 years. The subjective reports indicated that the conditions that yielded better performance were not considered especially burdensome. Therefore, although further work is needed to identify which face paradigm is best, it is clear that the canonical flash approach should be replaced with a face paradigm when aiming at increasing bit rate. However, the face paradigm has to be further explored with practical applications particularly with locked-in patients.",10.1371/journal.pone.0049688,,23189154,https://doi.org/10.1371/journal.pone.0049688,https://www.semanticscholar.org/paper/8f364a5a188401aaa6b598fd427fafd1e57f1279,https://journals.plos.org/plosone/article/file?id=10.1371/journal.pone.0049688&type=printable,Medicine; Physics; Psychology,False,
2012,32,,32,166.423,citations=140; influential=8; recognized venue; BCI term matches=2; title BCI matches=2; open PDF metadata,45565b613f30e6fb00ff67dc75d35b24ece2c847,A hybrid ERD/SSVEP BCI for continuous simultaneous two dimensional cursor control.,"B. Allison, C. Brunner, Christof Altstätter, Isabella C. Wagner, Sebastian Grissmann, C. Neuper",Journal of Neuroscience Methods,2012-08-15,140,8,"SSVEP, P300, and ERP Spellers",,10.1016/j.jneumeth.2012.06.022,,22771715,https://doi.org/10.1016/j.jneumeth.2012.06.022,https://www.semanticscholar.org/paper/45565b613f30e6fb00ff67dc75d35b24ece2c847,,Computer Science; Medicine,False,
2012,33,,33,153.83,citations=137; influential=7; BCI term matches=2; title BCI matches=2; open PDF metadata,25ee802e6c7628b44c6cbaced02a832f57887c72,Implementation of SSVEP based BCI with Emotiv EPOC,"Yue-Lin Liu, Xiao Jiang, T. Cao, Feng Wan, P. Mak, Pu Mak, et al.",2012 IEEE International Conference on Virtual Environments Human-Computer Interfaces and Measurement Systems (VECIMS) Proceedings,2012-07-02,137,7,"SSVEP, P300, and ERP Spellers",,10.1109/VECIMS.2012.6273184,,,https://doi.org/10.1109/VECIMS.2012.6273184,https://www.semanticscholar.org/paper/25ee802e6c7628b44c6cbaced02a832f57887c72,,Computer Science; Engineering,False,
2012,34,,34,162.766,citations=136; influential=6; recognized venue; BCI term matches=3; title BCI matches=2; open PDF metadata,839ea3e34fad6f9c79e595a8fc035d468da115aa,Multiple Frequencies Sequential Coding for SSVEP-Based Brain-Computer Interface,"Yangsong Zhang, Peng Xu, Tiejun Liu, Jun Hu, Rui Zhang, D. Yao",PLoS ONE,2012-03-06,136,6,"SSVEP, P300, and ERP Spellers","Background Steady-state visual evoked potential (SSVEP)-based brain-computer interface (BCI) has become one of the most promising modalities for a practical noninvasive BCI system. Owing to both the limitation of refresh rate of liquid crystal display (LCD) or cathode ray tube (CRT) monitor, and the specific physiological response property that only a very small number of stimuli at certain frequencies could evoke strong SSVEPs, the available frequencies for SSVEP stimuli are limited. Therefore, it may not be enough to code multiple targets with the traditional frequencies coding protocols, which poses a big challenge for the design of a practical SSVEP-based BCI. This study aimed to provide an innovative coding method to tackle this problem. Methodology/Principal Findings In this study, we present a novel protocol termed multiple frequencies sequential coding (MFSC) for SSVEP-based BCI. In MFSC, multiple frequencies are sequentially used in each cycle to code the targets. To fulfill the sequential coding, each cycle is divided into several coding epochs, and during each epoch, certain frequency is used. Obviously, different frequencies or the same frequency can be presented in the coding epochs, and the different epoch sequence corresponds to the different targets. To show the feasibility of MFSC, we used two frequencies to realize four targets and carried on an offline experiment. The current study shows that: 1) MFSC is feasible and efficient; 2) the performance of SSVEP-based BCI based on MFSC can be comparable to some existed systems. Conclusions/Significance The proposed protocol could potentially implement much more targets with the limited available frequencies compared with the traditional frequencies coding protocol. The efficiency of the new protocol was confirmed by real data experiment. We propose that the SSVEP-based BCI under MFSC might be a promising choice in the future.",10.1371/journal.pone.0029519,,22412829,https://doi.org/10.1371/journal.pone.0029519,https://www.semanticscholar.org/paper/839ea3e34fad6f9c79e595a8fc035d468da115aa,https://doi.org/10.1371/journal.pone.0029519,Computer Science; Medicine; Physics,False,
2012,35,,35,151.548,citations=135; influential=4; recognized venue; BCI term matches=1; title BCI matches=1; open PDF metadata,81aa480790821b419cdb49ad8225dfcae2750355,Target Selection With Hybrid Feature for BCI-Based 2-D Cursor Control,"J. Long, Yuanqing Li, Tianyou Yu, Z. Gu",IEEE Transactions on Biomedical Engineering,,135,4,"Hybrid, Affective, and Closed-loop BCIs",,10.1109/TBME.2011.2167718,,21926016,https://doi.org/10.1109/TBME.2011.2167718,https://www.semanticscholar.org/paper/81aa480790821b419cdb49ad8225dfcae2750355,,Computer Science; Medicine,False,
