year,rank,candidateRank,selectionRank,importanceScore,importanceReasons,paperId,title,authors,venue,publicationDate,citationCount,influentialCitationCount,category,abstract,doi,arxiv,pubmed,url,semanticScholarUrl,openAccessPdf,fieldsOfStudy,candidate,githubUrl,keywordTags,keyIdea,strengths,limitations,methodTags,paperLink
2008,39,,39,164.605,citations=135; influential=17; BCI term matches=1; title BCI matches=1; open PDF metadata,b415541bde1bf03367b1a52244094c6d6fbddd0e,Filter Bank Common Spatial Pattern (FBCSP) in Brain-Computer Interface,"Kai Keng Ang, Zhang Yang Chin, Haihong Zhang, Cuntai Guan",IEEE World Congress on Computational Intelligence,2008-06-01,135,17,General BCI Methods and Systems,,10.1109/ijcnn.2008.4634130,,,https://doi.org/10.1109/ijcnn.2008.4634130,https://www.semanticscholar.org/paper/b415541bde1bf03367b1a52244094c6d6fbddd0e,,Computer Science; Engineering,False,,non-invasive,Positions Filter Bank Common Spatial Pattern (FBCSP) in Brain-Computer Interface within General BCI Methods and Systems.,high citation signal (135); influential citation signal (17),"Broad BCI system claims often need stronger standardized evaluation across users, sessions, and devices.; Laboratory performance may not transfer to everyday usability, safety, and maintenance conditions.; Non-invasive signals are vulnerable to low signal-to-noise ratio, artifacts, and electrode setup variability.",BCI method,https://doi.org/10.1109/ijcnn.2008.4634130
2008,40,,40,144.02,citations=127; influential=2; recognized venue; BCI term matches=3; title BCI matches=1; open PDF metadata,4f754cc546b041b454021ad3d84498cf08638577,Cortical Imaging of Event-Related (de)Synchronization during Online Control of Brain-Computer Interface Using Minimum-Norm Estimates in Frequency Domain,"Han Yuan, A. Doud, A. Gururajan, Bin He",IEEE transactions on neural systems and rehabilitation engineering,2008-08-12,127,2,Motor Imagery and Movement Decoding,"It is of wide interest to study the brain activity that correlates to the control of brain-computer interface (BCI). In the present study, we have developed an approach to image the cortical rhythmic modulation associated with motor imagery using minimum-norm estimates in the frequency domain (MNEFD). The distribution of cortical sources of mu activity during online control of BCI was obtained with the MNEFD. Contralateral decrease (event-related desynchronization) and ipsilateral increase (event-related synchronization) are localized in the sensorimotor cortex during online control of BCI in a group of human subjects. Statistical source analysis revealed that maximum correlation with movement imagination is localized in sensorimotor cortex.",10.1109/TNSRE.2008.2003384,,18990646,https://doi.org/10.1109/tnsre.2008.2003384,https://www.semanticscholar.org/paper/4f754cc546b041b454021ad3d84498cf08638577,,Computer Science; Medicine,False,,human; SMR,It is of wide interest to study the brain activity that correlates to the control of brain-computer interface (BCI).,high citation signal (127); recognized venue,"SMR and movement decoders often need subject-specific calibration and may drift across sessions.; Offline motor-imagery accuracy may not translate to reliable continuous control or rehabilitation gains.; Participant variability can limit generalization across age, ability, disease status, and training experience.",BCI method,https://doi.org/10.1109/tnsre.2008.2003384
2008,41,,41,138.049,citations=115; influential=4; BCI term matches=1; title BCI matches=1; open PDF metadata,016ba3b9c6122c68bfe8a6ff694481eee672d5db,Control of a Wheelchair by Motor Imagery in Real Time,"Kyuwan Choi, A. Cichocki",Ideal,2008-11-02,115,4,Motor Imagery and Movement Decoding,,10.1007/978-3-540-88906-9_42,,,https://doi.org/10.1007/978-3-540-88906-9_42,https://www.semanticscholar.org/paper/016ba3b9c6122c68bfe8a6ff694481eee672d5db,,Computer Science; Engineering; Medicine,False,,SMR,Positions Control of a Wheelchair by Motor Imagery in Real Time within Motor Imagery and Movement Decoding.,high citation signal (115),SMR and movement decoders often need subject-specific calibration and may drift across sessions.; Offline motor-imagery accuracy may not translate to reliable continuous control or rehabilitation gains.,BCI method,https://doi.org/10.1007/978-3-540-88906-9_42
2008,42,,42,143.65,citations=113; influential=3; recognized venue; BCI term matches=1; title BCI matches=1; open PDF metadata,041cc574229f23e35d010ce571dbf3f499989673,Brain-computer interfaces (BCIs): detection instead of classification.,"G. Schalk, P. Brunner, P. Brunner, L. Gerhardt, H. Bischof, J. Wolpaw, et al.",Journal of Neuroscience Methods,2008-01-15,113,3,EEG Signal Processing and Datasets,,10.1016/J.JNEUMETH.2007.08.010,,17920134,https://doi.org/10.1016/j.jneumeth.2007.08.010,https://www.semanticscholar.org/paper/041cc574229f23e35d010ce571dbf3f499989673,,Computer Science; Medicine,False,,non-invasive,Positions Brain-computer interfaces (BCIs): detection instead of classification. within EEG Signal Processing and Datasets.,high citation signal (113); recognized venue,"Dataset and preprocessing choices can bias comparisons across algorithms and laboratories.; Artifact robustness and sensor-setup variability need stronger external validation.; Non-invasive signals are vulnerable to low signal-to-noise ratio, artifacts, and electrode setup variability.",BCI method,https://doi.org/10.1016/j.jneumeth.2007.08.010
2008,43,,43,142.533,citations=107; influential=6; BCI term matches=1; title BCI matches=1; open PDF metadata,b9d00d17fd6f76e4570a04d7893919af90a0caca,"A brain-machine interface using dry-contact, low-noise EEG sensors","Thomas J. Sullivan, S. Deiss, T. Jung, G. Cauwenberghs",2008 IEEE International Symposium on Circuits and Systems,2008-05-18,107,6,EEG Signal Processing and Datasets,,10.1109/ISCAS.2008.4541835,,,https://doi.org/10.1109/iscas.2008.4541835,https://www.semanticscholar.org/paper/b9d00d17fd6f76e4570a04d7893919af90a0caca,http://www.isn.ucsd.edu/pubs/iscas08_eeg.pdf,Computer Science; Engineering; Medicine,False,,non-invasive,"Positions A brain-machine interface using dry-contact, low-noise EEG sensors within EEG Signal Processing and Datasets.",high citation signal (107); open-access PDF metadata,"Dataset and preprocessing choices can bias comparisons across algorithms and laboratories.; Artifact robustness and sensor-setup variability need stronger external validation.; Non-invasive signals are vulnerable to low signal-to-noise ratio, artifacts, and electrode setup variability.",BCI method,https://doi.org/10.1109/iscas.2008.4541835
2008,44,,44,132.256,citations=106; influential=3; BCI term matches=1; title BCI matches=1; open PDF metadata,7e9797e9c07d8e00a8fa585d6369344c689505c9,fMRI Brain-Computer Interfaces,"R. Sitaram, N. Weiskopf, A. Caria, R. Veit, M. Erb, N. Birbaumer",IEEE Signal Processing Magazine,,106,3,General BCI Methods and Systems,,10.1109/MSP.2008.4408446,,,https://doi.org/10.1109/msp.2008.4408446,https://www.semanticscholar.org/paper/7e9797e9c07d8e00a8fa585d6369344c689505c9,,Computer Science,False,,non-invasive,Positions fMRI Brain-Computer Interfaces within General BCI Methods and Systems.,high citation signal (106),"Broad BCI system claims often need stronger standardized evaluation across users, sessions, and devices.; Laboratory performance may not transfer to everyday usability, safety, and maintenance conditions.; Non-invasive signals are vulnerable to low signal-to-noise ratio, artifacts, and electrode setup variability.",BCI method,https://doi.org/10.1109/msp.2008.4408446
2008,45,,45,126.662,citations=104; influential=2; BCI term matches=1; title BCI matches=1; open PDF metadata,b36601f18bcd63677009bdfc9b4ab8e5276a23a3,Classifying EEG for brain computer interfaces using Gaussian processes,"Mingjun Zhong, F. Lotte, M. Girolami, A. Lécuyer",Pattern Recognition Letters,2008-02-01,104,2,EEG Signal Processing and Datasets,,10.1016/j.patrec.2007.10.009,,,https://doi.org/10.1016/j.patrec.2007.10.009,https://www.semanticscholar.org/paper/b36601f18bcd63677009bdfc9b4ab8e5276a23a3,,Computer Science; Engineering; Medicine,False,,non-invasive,Positions Classifying EEG for brain computer interfaces using Gaussian processes within EEG Signal Processing and Datasets.,high citation signal (104),"Dataset and preprocessing choices can bias comparisons across algorithms and laboratories.; Artifact robustness and sensor-setup variability need stronger external validation.; Non-invasive signals are vulnerable to low signal-to-noise ratio, artifacts, and electrode setup variability.",BCI method,https://doi.org/10.1016/j.patrec.2007.10.009
2008,46,,46,142.216,citations=102; influential=5; BCI term matches=2; title BCI matches=2; open PDF metadata,0fa8098f3f1f54b940b986c26289db24cc5855a9,Visual P300-based BCI to steer a wheelchair: A Bayesian approach,"G. Pires, M. Castelo‐Branco, U. Nunes",Annual International Conference of the IEEE Engineering in Medicine and Biology Society,2008-10-14,102,5,"SSVEP, P300, and ERP Spellers",,10.1109/IEMBS.2008.4649238,,19162741,https://doi.org/10.1109/iembs.2008.4649238,https://www.semanticscholar.org/paper/0fa8098f3f1f54b940b986c26289db24cc5855a9,,Computer Science; Engineering; Medicine,False,,non-invasive; SSVEP; P300,"Positions Visual P300-based BCI to steer a wheelchair: A Bayesian approach within SSVEP, P300, and ERP Spellers.",high citation signal (102),"Visual spellers can be constrained by gaze dependence, stimulus comfort, and fatigue during long sessions.; Controlled target layouts and calibration conditions may not transfer to everyday communication.; Non-invasive signals are vulnerable to low signal-to-noise ratio, artifacts, and electrode setup variability.",BCI method,https://doi.org/10.1109/iembs.2008.4649238
2008,47,,47,142.216,citations=102; influential=5; BCI term matches=2; title BCI matches=2; open PDF metadata,3831a24ccc78be4a28faab777fb0ba585ab54ee3,Simultaneous Real-Time Detection of Motor Imagery and Error-Related Potentials for Improved BCI Accuracy,"P. Ferrez, J. Millán",,,102,5,Motor Imagery and Movement Decoding,,,,,https://www.semanticscholar.org/paper/3831a24ccc78be4a28faab777fb0ba585ab54ee3,https://www.semanticscholar.org/paper/3831a24ccc78be4a28faab777fb0ba585ab54ee3,,Computer Science; Engineering; Medicine,False,,SMR,Positions Simultaneous Real-Time Detection of Motor Imagery and Error-Related Potentials for Improved BCI Accuracy within Motor Imagery and Movement Decoding.,high citation signal (102),SMR and movement decoders often need subject-specific calibration and may drift across sessions.; Offline motor-imagery accuracy may not translate to reliable continuous control or rehabilitation gains.,BCI method,https://www.semanticscholar.org/paper/3831a24ccc78be4a28faab777fb0ba585ab54ee3
2008,48,,48,137.621,citations=97; influential=5; BCI term matches=1; title BCI matches=1; open PDF metadata,410ba0d4fe4244c3097af17f1100bef17533c312,Brain Computer Interface for Communication and Control,Rehab Ashary,,,97,5,"Speech, Language, and Communication BCIs",,,,,https://www.semanticscholar.org/paper/410ba0d4fe4244c3097af17f1100bef17533c312,https://www.semanticscholar.org/paper/410ba0d4fe4244c3097af17f1100bef17533c312,,Computer Science; Engineering; Medicine,False,,human,"Positions Brain Computer Interface for Communication and Control within Speech, Language, and Communication BCIs.",selected by citation count from the audited BCI candidate pool,"Communication systems must still balance accuracy, latency, vocabulary size, privacy, and user autonomy.; Many decoding results rely on constrained tasks or limited participant diversity.; Participant variability can limit generalization across age, ability, disease status, and training experience.",communication,https://www.semanticscholar.org/paper/410ba0d4fe4244c3097af17f1100bef17533c312
2008,49,,49,147.847,citations=94; influential=10; BCI term matches=1; title BCI matches=1; open PDF metadata,785460c44261d883e0900238ed888cefa962f3e8,Sparse spatial filter optimization for EEG channel reduction in brain-computer interface,"X. Yong, R. Ward, G. Birch","IEEE International Conference on Acoustics, Speech, and Signal Processing",2008-05-12,94,10,EEG Signal Processing and Datasets,,10.1109/ICASSP.2008.4517635,,,https://doi.org/10.1109/icassp.2008.4517635,https://www.semanticscholar.org/paper/785460c44261d883e0900238ed888cefa962f3e8,,Computer Science; Medicine,False,,non-invasive,Positions Sparse spatial filter optimization for EEG channel reduction in brain-computer interface within EEG Signal Processing and Datasets.,influential citation signal (10),"Dataset and preprocessing choices can bias comparisons across algorithms and laboratories.; Artifact robustness and sensor-setup variability need stronger external validation.; Non-invasive signals are vulnerable to low signal-to-noise ratio, artifacts, and electrode setup variability.",BCI method,https://doi.org/10.1109/icassp.2008.4517635
2008,50,,50,149.244,citations=92; influential=6; recognized venue; BCI term matches=1; title BCI matches=1; open PDF metadata,681d8358e4b0b7b2030df8e65181df7eb86d3be8,Defining brain-machine interface applications by matching interface performance with device requirements.,"O. Tonet, M. Marinelli, L. Citi, P. Rossini, L. Rossini, G. Megali, et al.",Journal of Neuroscience Methods,2008-01-15,92,6,General BCI Methods and Systems,,10.1016/J.JNEUMETH.2007.03.015,,17499364,https://doi.org/10.1016/j.jneumeth.2007.03.015,https://www.semanticscholar.org/paper/681d8358e4b0b7b2030df8e65181df7eb86d3be8,,Computer Science; Engineering; Medicine,False,,non-invasive,Positions Defining brain-machine interface applications by matching interface performance with device requirements. within General BCI Methods and Systems.,recognized venue,"Broad BCI system claims often need stronger standardized evaluation across users, sessions, and devices.; Laboratory performance may not transfer to everyday usability, safety, and maintenance conditions.; Non-invasive signals are vulnerable to low signal-to-noise ratio, artifacts, and electrode setup variability.",BCI method,https://doi.org/10.1016/j.jneumeth.2007.03.015
2008,51,,51,143.046,citations=89; influential=8; BCI term matches=1; title BCI matches=1; open PDF metadata,78b244ef8f1e604553532dc44ddaa5d9da3b3136,Study of Electroencephalographic Signal Processing and Classification Techniques towards the use of Brain-Computer Interfaces in Virtual Reality Applications,F. Lotte,,2008-12-04,89,8,EEG Signal Processing and Datasets,,,,,https://www.semanticscholar.org/paper/78b244ef8f1e604553532dc44ddaa5d9da3b3136,https://www.semanticscholar.org/paper/78b244ef8f1e604553532dc44ddaa5d9da3b3136,,Computer Science; Engineering; Medicine,False,,non-invasive,Positions Study of Electroencephalographic Signal Processing and Classification Techniques towards the use of Brain-Computer Interfaces in Virtual Reality Applications within EEG Signal Processing and Datasets.,selected by citation count from the audited BCI candidate pool,"Dataset and preprocessing choices can bias comparisons across algorithms and laboratories.; Artifact robustness and sensor-setup variability need stronger external validation.; Non-invasive signals are vulnerable to low signal-to-noise ratio, artifacts, and electrode setup variability.",BCI method,https://www.semanticscholar.org/paper/78b244ef8f1e604553532dc44ddaa5d9da3b3136
2008,52,,52,130.776,citations=87; influential=2; dataset/benchmark; BCI term matches=3; title BCI matches=1; open PDF metadata,1865985d65c4c865587d326c6e7d4a2c56f2b905,Pattern Recognition of Motor Imagery EEG using Wavelet Transform,"Baoheng Xu, Ai-Guo Song",,2008-05-01,87,2,Motor Imagery and Movement Decoding,"Brain-computer interface (BCI) provides new communication and control channels that do not depend on the brain’s normal output of peripheral nerves and muscles. In this paper, we report on results of developing a single trial online motor imagery feature extraction method for BCI. The wavelet coefficients and autoregressive parameter model was used to extraction the features from the motor imagery EEG and the linear discriminant analysis based on mahalanobis distance was utilized to classify the pattern of left and right hand movement imagery. The performance was tested by the Graz dataset for BCI competition 2003 and satisfactory results are obtained with an error rate as low as 10.0%.",10.4236/JBISE.2008.11010,,,https://doi.org/10.4236/jbise.2008.11010,https://www.semanticscholar.org/paper/1865985d65c4c865587d326c6e7d4a2c56f2b905,http://www.scirp.org/journal/PaperDownload.aspx?paperID=19,Computer Science; Engineering,False,,non-invasive; SMR; arm-direction,Brain-computer interface (BCI) provides new communication and control channels that do not depend on the brain’s normal output of peripheral nerves and muscles.,open-access PDF metadata,"Benchmark value depends on standardized protocols, transparent splits, and external replication.; Communication systems must still balance accuracy, latency, vocabulary size, privacy, and user autonomy.; SMR and movement decoders often need subject-specific calibration and may drift across sessions.",dataset/benchmark; communication,https://doi.org/10.4236/jbise.2008.11010
2008,53,,53,130.948,citations=83; influential=4; BCI term matches=1; title BCI matches=1; open PDF metadata,0a1af7a3fa9e87bdea00fa72e89d5856b1bae698,Brain-computer interfaces for hci and games,"A. Nijholt, Desney S. Tan, B. Allison, J. Millán, B. Graimann",CHI Extended Abstracts,2008-04-05,83,4,General BCI Methods and Systems,,10.1145/1358628.1358958,,,https://doi.org/10.1145/1358628.1358958,https://www.semanticscholar.org/paper/0a1af7a3fa9e87bdea00fa72e89d5856b1bae698,,Computer Science,False,,non-invasive,Positions Brain-computer interfaces for hci and games within General BCI Methods and Systems.,selected by citation count from the audited BCI candidate pool,"Broad BCI system claims often need stronger standardized evaluation across users, sessions, and devices.; Laboratory performance may not transfer to everyday usability, safety, and maintenance conditions.; Non-invasive signals are vulnerable to low signal-to-noise ratio, artifacts, and electrode setup variability.",BCI method,https://doi.org/10.1145/1358628.1358958
2008,54,,54,101.448,citations=81; influential=0; BCI term matches=1; title BCI matches=1; open PDF metadata,9f097dff6ed0dbf4380a3411defbd3be74306bfa,Control of an Internet Browser Using the P300 Event- Related Potential,"M. Bensch, Sebastian Halder, W. Rosenstiel, A. Kübler, Eberhard Karls, Emily M. Mugler",,,81,0,"SSVEP, P300, and ERP Spellers",,,,,https://www.semanticscholar.org/paper/9f097dff6ed0dbf4380a3411defbd3be74306bfa,https://www.semanticscholar.org/paper/9f097dff6ed0dbf4380a3411defbd3be74306bfa,,Computer Science; Engineering; Medicine,False,,non-invasive; SSVEP; P300,"Positions Control of an Internet Browser Using the P300 Event- Related Potential within SSVEP, P300, and ERP Spellers.",selected by citation count from the audited BCI candidate pool,"Visual spellers can be constrained by gaze dependence, stimulus comfort, and fatigue during long sessions.; Controlled target layouts and calibration conditions may not transfer to everyday communication.; Non-invasive signals are vulnerable to low signal-to-noise ratio, artifacts, and electrode setup variability.",BCI method,https://www.semanticscholar.org/paper/9f097dff6ed0dbf4380a3411defbd3be74306bfa
2008,55,,55,113.655,citations=80; influential=1; BCI term matches=1; title BCI matches=1; open PDF metadata,55fd2d967945624a5457f204b9cecbbc1ed54ad2,Combining brain computer interfaces with vision for object categorization,"Ashish Kapoor, P. Shenoy, Desney S. Tan",2008 IEEE Conference on Computer Vision and Pattern Recognition,2008-06-01,80,1,Invasive and Implantable Interfaces,"Human-aided computing proposes using information measured directly from the human brain in order to perform useful tasks. In this paper, we extend this idea by fusing computer vision-based processing and processing done by the human brain in order to build more effective object categorization systems. Specifically, we use an electroencephalograph (EEG) device to measure the subconscious cognitive processing that occurs in the brain as users see images, even when they are not trying to explicitly classify them. We present a novel framework that combines a discriminative visual category recognition system based on the pyramid match kernel (PMK) with information derived from EEG measurements as users view images. We propose a fast convex kernel alignment algorithm to effectively combine the two sources of information. Our approach is validated with experiments using real-world data, where we show significant gains in classification accuracy. We analyze the properties of this information fusion method by examining the relative contributions of the two modalities, the errors arising from each source, and the stability of the combination in repeated experiments.",10.1109/CVPR.2008.4587618,,,https://doi.org/10.1109/cvpr.2008.4587618,https://www.semanticscholar.org/paper/55fd2d967945624a5457f204b9cecbbc1ed54ad2,,Computer Science,False,,invasive; non-invasive; human,Human-aided computing proposes using information measured directly from the human brain in order to perform useful tasks.,selected by citation count from the audited BCI candidate pool,"Surgical risk, device durability, and long-term signal stability constrain clinical translation.; Small participant cohorts make headline decoding performance difficult to generalize.; Non-invasive signals are vulnerable to low signal-to-noise ratio, artifacts, and electrode setup variability.",BCI method,https://doi.org/10.1109/cvpr.2008.4587618
2008,56,,56,123.381,citations=79; influential=1; recognized venue; BCI term matches=1; title BCI matches=1; open PDF metadata,35bf646aa182d8e095d1cb55f77f3269248f552c,Frequency detection with stability coefficient for steady-state visual evoked potential (SSVEP)-based BCIs,"Zhenghua Wu, D. Yao",Journal of Neural Engineering,2008-03-15,79,1,"SSVEP, P300, and ERP Spellers",,10.1088/1741-2560/5/1/004,,18310809,https://doi.org/10.1088/1741-2560/5/1/004,https://www.semanticscholar.org/paper/35bf646aa182d8e095d1cb55f77f3269248f552c,,Computer Science; Engineering; Medicine; Physics,False,,non-invasive; SSVEP; P300,"Positions Frequency detection with stability coefficient for steady-state visual evoked potential (SSVEP)-based BCIs within SSVEP, P300, and ERP Spellers.",recognized venue,"Visual spellers can be constrained by gaze dependence, stimulus comfort, and fatigue during long sessions.; Controlled target layouts and calibration conditions may not transfer to everyday communication.; Non-invasive signals are vulnerable to low signal-to-noise ratio, artifacts, and electrode setup variability.",BCI method,https://doi.org/10.1088/1741-2560/5/1/004
2008,57,,57,124.143,citations=73; influential=3; BCI term matches=1; title BCI matches=1; open PDF metadata,0c27303d9ad067cf4a603067706cd804407253d6,A brain-computer interface tool to assess cognitive functions in completely paralyzed patients with amyotrophic lateral sclerosis.,"I. Iversen, N. Ghanayim, A. Kübler, N. Neumann, N. Birbaumer, Jochen Kaiser",Clinical Neurophysiology,2008-10-01,73,3,General BCI Methods and Systems,,10.1016/j.clinph.2008.07.001,,18762448,https://doi.org/10.1016/j.clinph.2008.07.001,https://www.semanticscholar.org/paper/0c27303d9ad067cf4a603067706cd804407253d6,,Medicine; Psychology,False,,human,Positions A brain-computer interface tool to assess cognitive functions in completely paralyzed patients with amyotrophic lateral sclerosis. within General BCI Methods and Systems.,selected by citation count from the audited BCI candidate pool,"Broad BCI system claims often need stronger standardized evaluation across users, sessions, and devices.; Laboratory performance may not transfer to everyday usability, safety, and maintenance conditions.; Participant variability can limit generalization across age, ability, disease status, and training experience.",BCI method,https://doi.org/10.1016/j.clinph.2008.07.001
2008,58,,58,141.057,citations=71; influential=4; recognized venue; BCI term matches=2; title BCI matches=2; open PDF metadata,ca0fc586453f9544e03e7294a6efd7324c8414ed,Comparison of DFT and lock-in amplifier features and search for optimal electrode positions in SSVEP-based BCI.,"G. Müller-Putz, E. Eder, S. Wriessnegger, G. Pfurtscheller",Journal of Neuroscience Methods,2008-02-15,71,4,"SSVEP, P300, and ERP Spellers",,10.1016/J.JNEUMETH.2007.09.024,,17980917,https://doi.org/10.1016/j.jneumeth.2007.09.024,https://www.semanticscholar.org/paper/ca0fc586453f9544e03e7294a6efd7324c8414ed,,Computer Science; Engineering; Medicine,False,,non-invasive; SSVEP; P300,"Positions Comparison of DFT and lock-in amplifier features and search for optimal electrode positions in SSVEP-based BCI. within SSVEP, P300, and ERP Spellers.",recognized venue,"Visual spellers can be constrained by gaze dependence, stimulus comfort, and fatigue during long sessions.; Controlled target layouts and calibration conditions may not transfer to everyday communication.; Non-invasive signals are vulnerable to low signal-to-noise ratio, artifacts, and electrode setup variability.",BCI method,https://doi.org/10.1016/j.jneumeth.2007.09.024
