year,rank,paperId,title,authors,venue,publicationDate,citationCount,influentialCitationCount,category,abstract,doi,arxiv,pubmed,url,semanticScholarUrl,openAccessPdf,fieldsOfStudy,candidate
2026,65,a2e155bfd7d31808c40400c57adc22bccbce15d5,Render EEG-Based Brain–Computer Interfaces Calibration-Free: Trade Space for Time in EEG Decoding,"Maohua Liu, Shi Wang, Wenzhe Cui, Shihui Zhang, Liqiang Zhao, F. Beyette",IEEE Open Journal of Engineering in Medicine and Biology,2026-02-23,1,0,Motor Imagery and Movement Decoding,"Goal: Electroencephalogram-based brain-computer interfaces (EEG BCIs) have broad applications in neurorehabilitation, clinical assessment, and assistive technologies. However, their practical deployment is severely limited by subject-specific calibration, which requires time-consuming data collection and model retraining for each user, significantly reducing usability. This reliance on calibration arises from the conventional “one-model-fits-all” strategy: “relying on a single general model to handle all data complexity like subject variability. When its limited generalization falls short, time must be spent on calibration to adapt the model.” Methods: To address this limitation, we propose a trade-space-for-time strategy for calibration-free EEG decoding: “Instead of adapting one model to every user, we maintain a pool of compact models, including a general model and multiple biased models, where each biased model specializes in decoding a specific type of subject pattern. For a new input, the system automatically selects the most suitable model based on data characteristics, enabling instant adaptation without retraining.” Compact deep learning models make this design feasible by allowing fast switching and low storage cost, which would be impractical with large-scale architectures. Results: Experiments on multiple public EEG datasets show that the proposed strategy achieves performance comparable to within-subject decoding: slightly higher in one dataset (0.7672 vs. 0.7601), nearly identical in another (0.7568 vs. 0.7572), and marginally lower in a third (0.8804 vs. 0.8888). Conclusions: These results demonstrate that our approach effectively eliminates calibration while preserving accuracy, providing a practical and scalable alternative for EEG BCIs. The framework also has potential applications in other neuroimaging modalities such as fMRI and fNIRS.",10.1109/OJEMB.2026.3667029,,41970658,https://doi.org/10.1109/OJEMB.2026.3667029,https://www.semanticscholar.org/paper/a2e155bfd7d31808c40400c57adc22bccbce15d5,,Computer Science; Engineering; Medicine,False
2026,66,0b700ada155f1b55b551a8d1cb2cf442a90d9f3a,RMETNet: A cross-subject motor imagery EEG signal classification model based on TSLANet and riemannian geometry features,"Yun Zhao, Dongyi He, Fudai Ren, Qingling Xia, Linhao Xu, Guanghui Xie, et al.",PLoS ONE,2026-04-22,1,0,Motor Imagery and Movement Decoding,"Motor imagery electroencephalogram (MI-EEG) analysis is essential for natural interaction and autonomous control in brain-computer interfaces (BCIs). However, deep learning models often struggle with inter-subject variability, which limits their ability to generalize across subjects. This study proposes RMETNet, a novel framework that integrates TSLANet, a spatio-temporal convolution module, and a multi-scale Riemannian geometry feature module. TSLANet suppresses noise and captures complex temporal patterns for preliminary signal decoding, while the spatio-temporal convolution module extracts higher-order representations. The Riemannian branch learns geometry-based distribution features across subjects, and the fused features are used for classification. To address inter-subject distribution shifts, RMETNet incorporates Maximum Mean Discrepancy (MMD) loss for domain adaptation, aligning feature distributions between source and target domains. Experiments show that on the four-class BCI Competition IV 2a (BCICIV2a) dataset, RMETNet achieved accuracies of 71.39% in the cross-subject setting and 80.71% in the subject-dependent setting; on the two-class BCI Competition IV 2b (BCICIV2b) dataset, it achieved 80.93% and 86.76%, respectively. The model consistently outperformed baseline algorithms. Ablation and visualization analyses further validated its effectiveness in reducing inter-subject feature distribution disparities and enhancing MI-EEG decoding. The code is available at: https://github.com/rokanfeermecer486/RMETNet.",10.1371/journal.pone.0347671,,42018586,https://doi.org/10.1371/journal.pone.0347671,https://www.semanticscholar.org/paper/0b700ada155f1b55b551a8d1cb2cf442a90d9f3a,,Computer Science; Medicine,False
2026,67,30102878b87eecd4833b8444450f814efc6a9afe,Polymer Brushes in Nanoelectronics: Nanotribology Insights from Fundamentals to Cutting-Edge Applications.,"Yange Feng, Wenpeng Wang, Guorui Zhang, F. Zhou, Bin Li",Nano letters (Print),2026-02-16,1,0,General BCI Methods and Systems,"Polymer brushes have gained significant attention in nanoelectronics due to their capability in surface modifications, interfacial physicochemical properties control, nanoscale patterning, and unique dielectric properties. The past few decades have witnessed significant progress made in this field, including the emergence of new concepts in synthetic strategy and molecular structure design and the latest attempts in nanoelectronics. Looking ahead, polymer brushes will continuously play roles in brain-computer interfaces, miniaturization in AI hardware, and next-generation flexible electronics. This Mini-Review summarizes and comments on recent developments and applications of polymer brushes in nanoelectronics, with particular emphasis on their interfacial frictional properties from a nanotribological perspective, which will be helpful for bridging interdisciplinary knowledge, refining existing techniques, and uncovering new applications.",10.1021/acs.nanolett.5c05456,,41693701,https://doi.org/10.1021/acs.nanolett.5c05456,https://www.semanticscholar.org/paper/30102878b87eecd4833b8444450f814efc6a9afe,,Engineering; Materials Science; Medicine,False
2026,68,d719a6e18a10a118c8d30de927cbb23fb0051922,Parameter-Efficient Fine-Tuning of EEG Foundation Models for Plug-and-Play Motor Imagery BCIs,"Urban Širca, Lovro Brulec, M. Alimardani",Balkan Conference in Informatics,2026-02-23,1,0,Motor Imagery and Movement Decoding,"Calibration remains a major barrier for practical motor imagery (MI) brain–computer interfaces (BCIs). This study investigates whether the pretrained EEG foundation model LaBraM can support minimal-calibration MI decoding and whether parameter-efficient fine-tuning via LoRA offers an effective and computationally efficient adaptation strategy. Using a 54-subject MI dataset and a leave-one-subject-out evaluation, we compared a CNN baseline (DeepConvNet), partial fine-tuning of LaBraM, and LaBraM with LoRA under controlled few-shot conditions. DeepConvNet achieved the highest overall accuracy across all calibration sizes, while LaBraM with LoRA showed more consistent subject-wise improvements and a steeper adaptation trajectory despite lower overall accuracy. LoRA-tuned LaBraM yielded reliably positive calibration gains across subjects, in contrast to the more variable behavior of the CNN and the instability of LaBraM with partial fine-tuning. In terms of efficiency, LoRA reduced trainable parameters by over two orders of magnitude and shortened the training time per epoch by 35% compared to partial fine-tuning. These findings suggest that, although foundation models currently fall short of specialized CNNs in MI decoding accuracy, parameter-efficient fine-tuning can still deliver fast and robust personalization from limited data, making them a promising solution for scalable plug-and-play MI-BCIs.",10.1109/BCI69045.2026.11435102,,,https://doi.org/10.1109/BCI69045.2026.11435102,https://www.semanticscholar.org/paper/d719a6e18a10a118c8d30de927cbb23fb0051922,,Computer Science; Engineering; Medicine,False
2026,69,5a383ca207ec4413da952bb2f9fde028275796fc,Parallel Brain–Computer Interface: Collaborative Control and Perception Based on Multibrain Division of Labor,"Zeqi Ye, Yang Yu, Yiyun Zhang, Zongtan Zhou, Dewen Hu, Ling-Li Zeng",IEEE Transactions on Cognitive and Developmental Systems,2026-04-01,1,0,"SSVEP, P300, and ERP Spellers","To date, brain–computer interfaces (BCIs) have adopted a serial working mechanism, causing performance bottlenecks due to time multiplication. In this study, we propose a parallel BCI (pBCI), which transforms the traditional sequential processing paradigm into multiple subparadigms based on division-labor mechanism, and then these subparadigms can be processed by multiple brains in a parallel and collaborative way. According to the proposed pBCI, we designed: 1) a collaborative speller paradigm where targets are encoded in a multidimensional space, with each brain focusing on a distinct dimension and collaborating on target localization; and 2) a collaborative perception paradigm with each brain contributing to a unique perspective of an autonomous vehicle and collaborating on perceiving dangers. We conducted both collaborative P300 Speller experiments and collaborative perception experiments to validate the feasibility and practicality of the proposed pBCI. The results reveal that the proposed pBCI boosted BCI performance by multibrain division-labor collaboration without increasing the workload for individuals, resulting in an information transfer rate improvement from 55.17 to 146.35 bits/min in collaborative speller, and a response time improvement from 1696 to 1130 ms in collaborative perception. In summary, the proposed pBCI provides a new and scalable BCI solution for more complex tasks and applications.",10.1109/TCDS.2025.3603145,,,https://doi.org/10.1109/TCDS.2025.3603145,https://www.semanticscholar.org/paper/5a383ca207ec4413da952bb2f9fde028275796fc,,Computer Science,False
2026,70,482a48c1d5a8ab6da2dd6a6a4a8e472a9135693f,PEARL: Prompt-Based EEG Adaptation via Resource-Efficient Learning for Generalizable Brain-Computer Interface,"Heejae Choi, Hyunseo Kim, Eun Yi Kim","IEEE International Conference on Acoustics, Speech, and Signal Processing",2026-05-03,1,0,EEG Signal Processing and Datasets,,10.1109/icassp55912.2026.11464243,,,https://doi.org/10.1109/icassp55912.2026.11464243,https://www.semanticscholar.org/paper/482a48c1d5a8ab6da2dd6a6a4a8e472a9135693f,,Computer Science; Engineering,False
2026,71,961b42daf363da1ca90f92e18af1da8d440b9131,PA-TCNet: Pathology-Aware Temporal Calibration with Physiology-Guided Target Refinement for Cross-Subject Motor Imagery EEG Decoding in Stroke Patients,"Xiangkai Wang, Yun Zhao, Dongyi He, Qingling Xia, Gen Li, Nizhuan Wang, et al.",arXiv.org,2026-04-17,1,0,Motor Imagery and Movement Decoding,"Stroke patient cross-subject electroencephalography (EEG) decoding of motor imagery (MI) brain-computer interface (BCI) is essential for motor rehabilitation, yet lesion-related abnormal temporal dynamics and pronounced inter-patient heterogeneity often undermine generalization. Existing adaptation methods are easily misled by pathological slow-wave activity and unstable target-domain pseudo-labels. To address this challenge, we propose PA-TCNet, a pathology-aware temporal calibration framework with physiology-guided target refinement for stroke motor imagery decoding. PA-TCNet integrates two coordinated components. The Pathology-aware Rhythmic State Mamba (PRSM) module decomposes EEG spatiotemporal features into slowly varying rhythmic context and fast transient perturbations, injecting the fused pathological context into selective state propagation to more effectively capture abnormal temporal dynamics. The Physiology-Guided Target Calibration (PGTC) module constructs source-domain sensorimotor region-of-interest templates, imposing physiological consistency constraints and dynamically refining target-domain pseudo-labels, thereby improving adaptation reliability. Leave-one-subject-out experiments on two independent stroke EEG datasets, XW-Stroke and 2019-Stroke, yielded mean accuracies of 66.56\% and 72.75\%, respectively, outperforming state-of-the-art baselines. These results indicate that jointly modeling pathological temporal dynamics and physiology-constrained pseudo-supervision can provide more robust cross-subject initialization for personalized post-stroke MI-BCI rehabilitation. The implemented code is available at https://github.com/wxk1224/PA-TCNet.",10.48550/arXiv.2604.16554,2604.16554,,https://doi.org/10.48550/arXiv.2604.16554,https://www.semanticscholar.org/paper/961b42daf363da1ca90f92e18af1da8d440b9131,,Computer Science; Engineering; Medicine,False
2026,72,c927285b278522b1b761a967d5b575a6948efbb6,OSFTL-PL: Online source-free transfer learning with pseudo-labels for privacy-preserving EEG-based BCI,"Siwei Liu, Keyan Chen, Jia Zhang, Jinyi Long, Hanrui Wu",Biomedical Signal Processing and Control,2026-04-01,1,0,EEG Signal Processing and Datasets,,10.1016/j.bspc.2025.109326,,,https://doi.org/10.1016/j.bspc.2025.109326,https://www.semanticscholar.org/paper/c927285b278522b1b761a967d5b575a6948efbb6,,Computer Science; Engineering; Medicine,False
2026,73,bdde7910ee4bc24b75b00882f50f1a63a6540b25,Neuronic Nash Equilibrium: An EEG Data-Driven Game-Theoretic Framework for BCI-Enabled Multi-Agent Behaviors,Quanyan Zhu,Automation,2026-05-18,1,0,EEG Signal Processing and Datasets,"A central goal of neuroeconomics is to understand how humans make decisions and how their neural processes interact during strategic situations. Game theory provides mathematical tools for modeling such interactions, with equilibrium concepts, most notably the Nash equilibrium, predicting stable patterns of behavior. Classical equilibrium analysis, however, treats cognition as a black box and assumes fully rational agents, whereas human decision making is shaped by bounded rationality, heuristics, and neural constraints. To bridge this gap, we investigate equilibrium behavior directly in the space of neurocognitive activity. Electroencephalogram (EEG) signals provide a high-resolution measurement of neural dynamics underlying attention, conflict monitoring, and evidence accumulation. In this work, we introduce a Neuronic Nash equilibrium, an equilibrium concept defined not in the action space but in the EEG-derived neural representation space. We develop a framework for analyzing two-player turn-based games in EEG space by constructing DMD-based neural embeddings and associated directed network representations. Dynamic Mode Decomposition (DMD) reveals statistically significant differences between the neural dynamics associated with distinct strategic actions, demonstrating that EEG-derived features preserve behaviorally meaningful cognitive structure. The resulting neuronic network representation enables equilibrium analysis directly at the neural level and provides a principled method for linking strategic behavior with stable patterns of neural activity. Our findings suggest that neural-state equilibrium concepts can capture the cognitive foundations of strategic interaction and offer a pathway toward characterizing cognitive equilibrium outcomes in multi-agent settings.",10.3390/automation7030078,,,https://doi.org/10.3390/automation7030078,https://www.semanticscholar.org/paper/bdde7910ee4bc24b75b00882f50f1a63a6540b25,,Computer Science,False
2026,74,866a11f80484e6a626aa625cb0be0b2f07b96b1f,NeuroPath: Practically Adopting Motor Imagery Decoding through EEG Signals,"Jiani Cao, Kun Wang, Yang Liu, Zhenjiang Li",ACM International Conference on Embedded Networked Sensor Systems,2026-03-30,1,0,Motor Imagery and Movement Decoding,"Motor Imagery (MI) is an emerging Brain-Computer Interface (BCI) paradigm where a person imagines body movements without physical action. By decoding scalp-recorded electroencephalography (EEG) signals, BCIs establish direct communication to control external devices, offering significant potential in prosthetics, rehabilitation, and human-computer interaction. However, existing solutions remain difficult to deploy. (i) Most employ independent, opaque models for each MI task, lacking a unified architectural foundation. Consequently, these models are trained in isolation, failing to learn robust representations from diverse datasets, resulting in modest performance. (ii) They primarily adopt fixed sensor deployment, whereas real-world setups vary in electrode number and placement, causing models to fail across configurations. (iii) Performance degrades sharply under low-SNR conditions typical of consumer-grade EEG. To address these challenges, we present NeuroPath, a neural architecture for robust MI decoding. NeuroPath takes inspiration from the brain's signal pathway from cortex to scalp, utilizing a deep neural architecture with specialized modules for signal filtering, spatial representation learning, and feature classification, enabling unified decoding. To handle varying electrode configurations, we introduce a spatially aware graph adapter accommodating different electrode numbers and placements. To enhance robustness under low-SNR conditions, NeuroPath incorporates multimodal auxiliary training to refine EEG representations and stabilize performance on noisy real-world data. Evaluations on three consumer-grade and three medical-grade public datasets demonstrate that NeuroPath achieves superior performance.",10.1145/3774906.3802770,2604.09654,,https://doi.org/10.1145/3774906.3802770,https://www.semanticscholar.org/paper/866a11f80484e6a626aa625cb0be0b2f07b96b1f,,Computer Science; Engineering,False
2026,75,25c71b3022c39c9da8c8230740f7c65db891a57b,NeuroDecoder: A new framework for image decoding and reconstruction of EEG signals.,"Wenxuan Ma, Hongxin Zhang, Yexuan Li, Mingyi Wei",IEEE journal of biomedical and health informatics,2026-04-23,1,0,EEG Signal Processing and Datasets,"Brain-Computer Interface (BCI) technology holds great promise for enhancing human health and quality of life, with visual stimulus reconstruction from EEG signals being a key application. However, the complexity and noise of EEG data challenge existing reconstruction methods. To address these issues, we propose NeuroDecoder, an end-to-end multimodal guidance generation framework that produces high-quality images from EEG signals. The key innovation is the collaborative mitigation of EEG noise and cross-modal representation discrepancies through a noise-robust encoder, mask-based triple-contrastive alignment, and a fixed generative model. Specifically, NeuroDecoder consists of three integrated learning stages: 1) EEG Decoding, 2) Modality Alignment, and 3) Image Reconstruction. In the decoding stage, a novel visual decoding model extracts visually relevant features with superior classification accuracy. In the alignment stage, a mask-based triple contrastive learning strategy achieves efficient cross-modal alignment of EEG, text, image, and edge map embeddings into a unified space. In the generation stage, a new reconstruction pipeline feeds the aligned EEG embeddings into a pre-trained stable diffusion model, enabling high-quality visual stimulus reconstruction with enhanced semantic and structural fidelity, without fine-tuning the generative model. On three EEG datasets, NeuroDecoder achieved subject-dependent classification accuracies of 99.76%, 94.41%, and 56.67%, respectively; in the subject-independent setting, it performed near random on EEGCVPR40 but reached 91.61% and 37.63% on the other two. For image reconstruction, it obtained Fréchet Inception Distance of 62.84 and 63.12 on the first two datasets. Extensive experiments demonstrate that NeuroDecoder outperforms prior methods in both EEG classification accuracy and image reconstruction quality.",10.1109/jbhi.2026.3686624,,42024948,https://doi.org/10.1109/jbhi.2026.3686624,https://www.semanticscholar.org/paper/25c71b3022c39c9da8c8230740f7c65db891a57b,,Computer Science; Engineering; Medicine,False
2026,76,4303598be8f5af15981ad392a2010b4c040b072b,Neurestore: A New Benchmark for Wearable BCI-Based Neuromotor Training in Real-World,"Anirban Chowdhury, M. Haque, Rab Nawaz, Uday R. Dholariya, K. Jani, Ronak P. Karmur, et al.",IEEE Access,,1,0,Motor Imagery and Movement Decoding,"Brain–computer interface (BCI)-based neuromotor training is widely recognized as a promising approach for post-stroke motor rehabilitation. However, its practical deployability remains uncertain due to challenges related to EEG headset wearability and the limited validation of emerging algorithms in noisy, real-world environments. These settings demand low-density, affordable EEG systems, robust multimodal neurofeedback paradigms, and validation with a sufficient number of participants in online scenarios. To address these challenges, we developed a BCI system using an 8-channel g.tec Unicorn headset and conducted experiments in a real-world noisy environment with 20 participants for offline analysis and another 20 for online evaluation. The system includes a hand exoskeleton to deliver multimodal concomitant neurofeedback. We evaluated both a traditional method (Common Spatial Pattern+Support Vector Machine (CSP+SVM)) and a deep learning architecture (Filter-Bank Convolutional Neural Network (FBCNet)) across this setup. Our results show that incorporating data preprocessing and a longest consecutive repetition (LCR) based post-processing step significantly ( $p\text {-value} \lt 0.05$ ) improves FBCNet’s performance in cross-subject decoding. In within-subject scenarios, CSP+SVM remains competitive with FBCNet, offering comparable accuracy with reduced training time. This study sets a comprehensive benchmark for the real-world deployment of wearable BCI systems for neuromotor training and provides a valuable testbed for evaluating future algorithms in practical, noisy environments.",10.1109/ACCESS.2026.3652957,,,https://doi.org/10.1109/ACCESS.2026.3652957,https://www.semanticscholar.org/paper/4303598be8f5af15981ad392a2010b4c040b072b,,Computer Science; Engineering; Medicine,False
2026,77,4af6a13f197bba544dc4589dd98eca9deecfa0c4,Multimodal MRI-EEG fusion for brain-computer interface applications using a lightweight CNN and attention in offline Parkinson's disease diagnosis,"Hongbo Guo, Shuotian Li, Guojun Long, Qiqi Liang, Yiran Wang",Biomedical Signal Processing and Control,2026-04-01,1,0,EEG Signal Processing and Datasets,,10.1016/j.bspc.2025.109432,,,https://doi.org/10.1016/j.bspc.2025.109432,https://www.semanticscholar.org/paper/4af6a13f197bba544dc4589dd98eca9deecfa0c4,,Computer Science; Engineering; Medicine,False
2026,78,d8ed99eea303c4fc6bb9e94f7c8403e70ef173ce,Multi-scale EEG feature decoding with Swin Transformers for subject independent motor imagery BCIs,"Wasi Ur Rehman Qamar, B. Abibullaev",Scientific Reports,2026-01-20,1,0,Motor Imagery and Movement Decoding,"High inter-subject variability and the non-stationary nature of EEG signals pose significant challenges for subject-independent Brain-Computer Interfaces (BCIs) leading to poor model generalization. Differences in neural activity patterns, electrode placements, and external noise further degrade performance making it difficult to develop BCIs that remain reliable across users without extensive recalibration. This study presents a Compact Convolutional Swin Transformer (CCST) to address this issue by using hierarchical window based self-attention combined with convolutional feature extraction to efficiently capture both local electrode interactions and global temporal dependencies. This multi-scale feature representation enhances generalization across subjects, a critical factor for real world BCI deployment. We evaluated CCST on the BCI Competition IV (2a, 2b) and PhysioNet MI datasets using Leave-One-Subject-Out (LOSO) cross-validation achieving state-of-the-art classification accuracies of 68.27%, 76.61%, and 71.70% respectively. Our statistical analysis using the Wilcoxon signed-rank test with Bonferroni correction confirms significant performance improvements over benchmark models. Additionally, CCST achieves a reduction in parameters and a decrease in FLOPs compared to full self-attention models making it more efficient for real-time BCI applications. These results establish CCST as a scalable and efficient framework for adaptive subject-independent BCIs with promising applications in neurorehabilitation, assistive technology, and cognitive training.",10.1038/s41598-025-32207-3,,41559106,https://doi.org/10.1038/s41598-025-32207-3,https://www.semanticscholar.org/paper/d8ed99eea303c4fc6bb9e94f7c8403e70ef173ce,,Computer Science; Engineering; Medicine,False
