year,rank,candidateRank,selectionRank,importanceScore,importanceReasons,paperId,title,authors,venue,publicationDate,citationCount,influentialCitationCount,category,abstract,doi,arxiv,pubmed,url,semanticScholarUrl,openAccessPdf,fieldsOfStudy,candidate,githubUrl
2012,1,,1,269.531,citations=1201; influential=156; recognized venue; dataset/benchmark; BCI term matches=3; title BCI matches=1; open PDF metadata,bc122aa1332985c4b346fc34b5cfdd65c22a08ea,Filter Bank Common Spatial Pattern Algorithm on BCI Competition IV Datasets 2a and 2b,"K. Ang, Z. Chin, C. Wang, Cuntai Guan, Haihong Zhang",Frontiers in Neuroscience,2012-03-29,1201,156,Motor Imagery and Movement Decoding,"The Common Spatial Pattern (CSP) algorithm is an effective and popular method for classifying 2-class motor imagery electroencephalogram (EEG) data, but its effectiveness depends on the subject-specific frequency band. This paper presents the Filter Bank Common Spatial Pattern (FBCSP) algorithm to optimize the subject-specific frequency band for CSP on Datasets 2a and 2b of the Brain-Computer Interface (BCI) Competition IV. Dataset 2a comprised 4 classes of 22 channels EEG data from 9 subjects, and Dataset 2b comprised 2 classes of 3 bipolar channels EEG data from 9 subjects. Multi-class extensions to FBCSP are also presented to handle the 4-class EEG data in Dataset 2a, namely, Divide-and-Conquer (DC), Pair-Wise (PW), and One-Versus-Rest (OVR) approaches. Two feature selection algorithms are also presented to select discriminative CSP features on Dataset 2b, namely, the Mutual Information-based Best Individual Feature (MIBIF) algorithm, and the Mutual Information-based Rough Set Reduction (MIRSR) algorithm. The single-trial classification accuracies were presented using 10 × 10-fold cross-validations on the training data and session-to-session transfer on the evaluation data from both datasets. Disclosure of the test data labels after the BCI Competition IV showed that the FBCSP algorithm performed relatively the best among the other submitted algorithms and yielded a mean kappa value of 0.569 and 0.600 across all subjects in Datasets 2a and 2b respectively.",10.3389/fnins.2012.00039,,22479236,https://doi.org/10.3389/fnins.2012.00039,https://www.semanticscholar.org/paper/bc122aa1332985c4b346fc34b5cfdd65c22a08ea,https://www.frontiersin.org/articles/10.3389/fnins.2012.00039/pdf,Computer Science; Engineering; Medicine,False,
2012,2,,2,233.803,citations=1125; influential=29; review/survey; clinical/rehab relevance; BCI term matches=2; title BCI matches=1; open PDF metadata,10b31d3058621d7c789cad876ed2dc2653e06b1b,"Brain Computer Interfaces, a Review","Luis F. Nicolás-Alonso, J. G. Gil",Italian National Conference on Sensors,2012-01-31,1125,29,Rehabilitation and Neuroprosthetics,"A brain-computer interface (BCI) is a hardware and software communications system that permits cerebral activity alone to control computers or external devices. The immediate goal of BCI research is to provide communications capabilities to severely disabled people who are totally paralyzed or ‘locked in’ by neurological neuromuscular disorders, such as amyotrophic lateral sclerosis, brain stem stroke, or spinal cord injury. Here, we review the state-of-the-art of BCIs, looking at the different steps that form a standard BCI: signal acquisition, preprocessing or signal enhancement, feature extraction, classification and the control interface. We discuss their advantages, drawbacks, and latest advances, and we survey the numerous technologies reported in the scientific literature to design each step of a BCI. First, the review examines the neuroimaging modalities used in the signal acquisition step, each of which monitors a different functional brain activity such as electrical, magnetic or metabolic activity. Second, the review discusses different electrophysiological control signals that determine user intentions, which can be detected in brain activity. Third, the review includes some techniques used in the signal enhancement step to deal with the artifacts in the control signals and improve the performance. Fourth, the review studies some mathematic algorithms used in the feature extraction and classification steps which translate the information in the control signals into commands that operate a computer or other device. Finally, the review provides an overview of various BCI applications that control a range of devices.",10.3390/s120201211,,22438708,https://doi.org/10.3390/s120201211,https://www.semanticscholar.org/paper/10b31d3058621d7c789cad876ed2dc2653e06b1b,https://www.mdpi.com/1424-8220/12/2/1211/pdf?version=1403316967,Computer Science; Engineering; Medicine,False,
2012,3,,3,232.622,citations=901; influential=77; BCI term matches=1; title BCI matches=1; open PDF metadata,955e2d6b7f237add6cde6b9786efbb7d9ef6893a,Brain-Computer Interfaces: Principles and Practice,"J. Wolpaw, E. Wolpaw",,2012-01-24,901,77,General BCI Methods and Systems,,,,,https://www.semanticscholar.org/paper/955e2d6b7f237add6cde6b9786efbb7d9ef6893a,https://www.semanticscholar.org/paper/955e2d6b7f237add6cde6b9786efbb7d9ef6893a,,Computer Science; Engineering; Psychology,False,
2012,4,,4,202.564,citations=647; influential=21; BCI term matches=1; title BCI matches=1; open PDF metadata,5904e38ea590c7eda3beeabdee5292577a830b84,Brain-computer interfaces in medicine.,"J. Shih, D. Krusienski, J. Wolpaw",Mayo Clinic proceedings,2012-03-01,647,21,General BCI Methods and Systems,,10.1016/j.mayocp.2011.12.008,,22325364,https://doi.org/10.1016/j.mayocp.2011.12.008,https://www.semanticscholar.org/paper/5904e38ea590c7eda3beeabdee5292577a830b84,http://www.mayoclinicproceedings.org/article/S0025619612001231/pdf,Engineering; Medicine,False,
2012,5,,5,179.679,citations=375; influential=11; BCI term matches=1; title BCI matches=1; open PDF metadata,15cd5d641accc81dcd64469526127706954dff26,Brain-Computer Interfaces: Beyond Medical Applications,"J. V. Erp, F. Lotte, M. Tangermann",Computer,2012-04-01,375,11,General BCI Methods and Systems,,10.1109/MC.2012.107,,,https://doi.org/10.1109/MC.2012.107,https://www.semanticscholar.org/paper/15cd5d641accc81dcd64469526127706954dff26,https://hal.inria.fr/hal-00688344/file/computer12_acceptedDraft.pdf,Computer Science; Medicine,False,
2012,6,,6,189.543,citations=364; influential=14; BCI term matches=4; title BCI matches=2; open PDF metadata,56d986c576d37c2f9599cabb8ba5a59660971045,P300 brain computer interface: current challenges and emerging trends,"R. Fazel-Rezai, B. Allison, C. Guger, E. Sellers, S. Kleih, A. Kübler",Frontiers in Neuroengineering,2012-07-17,364,14,Motor Imagery and Movement Decoding,"A brain-computer interface (BCI) enables communication without movement based on brain signals measured with electroencephalography (EEG). BCIs usually rely on one of three types of signals: the P300 and other components of the event-related potential (ERP), steady state visual evoked potential (SSVEP), or event related desynchronization (ERD). Although P300 BCIs were introduced over twenty years ago, the past few years have seen a strong increase in P300 BCI research. This closed-loop BCI approach relies on the P300 and other components of the ERP, based on an oddball paradigm presented to the subject. In this paper, we overview the current status of P300 BCI technology, and then discuss new directions: paradigms for eliciting P300s; signal processing methods; applications; and hybrid BCIs. We conclude that P300 BCIs are quite promising, as several emerging directions have not yet been fully explored and could lead to improvements in bit rate, reliability, usability, and flexibility.",10.3389/fneng.2012.00014,,22822397,https://doi.org/10.3389/fneng.2012.00014,https://www.semanticscholar.org/paper/56d986c576d37c2f9599cabb8ba5a59660971045,https://www.frontiersin.org/articles/10.3389/fneng.2012.00014/pdf,Computer Science; Engineering; Medicine,False,
2012,7,,7,186.74,citations=289; influential=13; recognized venue; BCI term matches=1; title BCI matches=1; open PDF metadata,f3acfc0bfd8cf1891965c7a1f5358367e86248be,A Hybrid Brain Computer Interface to Control the Direction and Speed of a Simulated or Real Wheelchair,"J. Long, Yuanqing Li, Hongtao Wang, Tianyou Yu, Jiahui Pan, Feng Li",IEEE transactions on neural systems and rehabilitation engineering,2012-06-06,289,13,"Hybrid, Affective, and Closed-loop BCIs",,10.1109/TNSRE.2012.2197221,,22692936,https://doi.org/10.1109/TNSRE.2012.2197221,https://www.semanticscholar.org/paper/f3acfc0bfd8cf1891965c7a1f5358367e86248be,,Computer Science; Engineering; Medicine,False,
2012,8,,8,186.473,citations=271; influential=25; BCI term matches=1; title BCI matches=1; open PDF metadata,bf420efbfaed18150e2d5ed42fc8cb2120a4f8d5,Psychological predictors of SMR-BCI performance.,"E. Hammer, Sebastian Halder, B. Blankertz, C. Sannelli, Thorsten Dickhaus, S. Kleih, et al.",Biological Psychology,,271,25,General BCI Methods and Systems,,10.1016/j.biopsycho.2011.09.006,,21964375,https://doi.org/10.1016/j.biopsycho.2011.09.006,https://www.semanticscholar.org/paper/bf420efbfaed18150e2d5ed42fc8cb2120a4f8d5,,Medicine; Psychology,False,
2012,9,,9,173.797,citations=270; influential=8; clinical/rehab relevance; BCI term matches=2; title BCI matches=1; open PDF metadata,aa5ec112ead30062c44732fb9d3a9b5875df1ca7,Gaming control using a wearable and wireless EEG-based brain-computer interface device with novel dry foam-based sensors,"Lun-De Liao, Chi-Yu Chen, I-Jan Wang, Sheng-Fu Chen, Shih-Yu Li, Bo-Wei Chen, et al.",Journal of NeuroEngineering and Rehabilitation,2012-01-28,270,8,Rehabilitation and Neuroprosthetics,"A brain-computer interface (BCI) is a communication system that can help users interact with the outside environment by translating brain signals into machine commands. The use of electroencephalographic (EEG) signals has become the most common approach for a BCI because of their usability and strong reliability. Many EEG-based BCI devices have been developed with traditional wet- or micro-electro-mechanical-system (MEMS)-type EEG sensors. However, those traditional sensors have uncomfortable disadvantage and require conductive gel and skin preparation on the part of the user. Therefore, acquiring the EEG signals in a comfortable and convenient manner is an important factor that should be incorporated into a novel BCI device. In the present study, a wearable, wireless and portable EEG-based BCI device with dry foam-based EEG sensors was developed and was demonstrated using a gaming control application. The dry EEG sensors operated without conductive gel; however, they were able to provide good conductivity and were able to acquire EEG signals effectively by adapting to irregular skin surfaces and by maintaining proper skin-sensor impedance on the forehead site. We have also demonstrated a real-time cognitive stage detection application of gaming control using the proposed portable device. The results of the present study indicate that using this portable EEG-based BCI device to conveniently and effectively control the outside world provides an approach for researching rehabilitation engineering.",10.1186/1743-0003-9-5,,22284235,https://doi.org/10.1186/1743-0003-9-5,https://www.semanticscholar.org/paper/aa5ec112ead30062c44732fb9d3a9b5875df1ca7,https://jneuroengrehab.biomedcentral.com/counter/pdf/10.1186/1743-0003-9-5,Computer Science; Engineering; Medicine,False,
2012,10,,10,187.838,citations=259; influential=13; recognized venue; BCI term matches=2; title BCI matches=2; open PDF metadata,6a6b886e3cad634c892f310288550be57397a7a6,Development of an SSVEP-based BCI spelling system adopting a QWERTY-style LED keyboard.,"Han-Jeong Hwang, Jeong-Hwan Lim, Young-Jin Jung, Han Choi, S. W. Lee, C. Im",Journal of Neuroscience Methods,2012-06-30,259,13,"SSVEP, P300, and ERP Spellers",,10.1016/j.jneumeth.2012.04.011,,22580222,https://doi.org/10.1016/j.jneumeth.2012.04.011,https://www.semanticscholar.org/paper/6a6b886e3cad634c892f310288550be57397a7a6,,Computer Science; Engineering; Medicine,False,
2012,11,,11,171.084,citations=224; influential=7; recognized venue; BCI term matches=1; title BCI matches=1; open PDF metadata,369b7a20b46a289927a0349a32ab2aa4d4921c88,Electroencephalography (EEG)-Based Brain–Computer Interface (BCI): A 2-D Virtual Wheelchair Control Based on Event-Related Desynchronization/Synchronization and State Control,"Dandan Huang, Kai Qian, D. Fei, Wenchuan Jia, Xuedong Chen, O. Bai",IEEE transactions on neural systems and rehabilitation engineering,2012-04-05,224,7,EEG Signal Processing and Datasets,,10.1109/TNSRE.2012.2190299,,22498703,https://doi.org/10.1109/TNSRE.2012.2190299,https://www.semanticscholar.org/paper/369b7a20b46a289927a0349a32ab2aa4d4921c88,,Computer Science; Engineering; Medicine; Psychology,False,
2012,12,,12,176.521,citations=221; influential=10; recognized venue; BCI term matches=1; title BCI matches=1; open PDF metadata,60163b54746ca38b2c7cc39938838612b68a4b54,Toward Brain-Actuated Humanoid Robots: Asynchronous Direct Control Using an EEG-Based BCI,"Yongwook Chae, Jaeseung Jeong, Sungho Jo",IEEE Transactions on robotics,2012-10-01,221,10,EEG Signal Processing and Datasets,,10.1109/TRO.2012.2201310,,,https://doi.org/10.1109/TRO.2012.2201310,https://www.semanticscholar.org/paper/60163b54746ca38b2c7cc39938838612b68a4b54,,Computer Science; Engineering; Medicine,False,
2012,13,,13,189.158,citations=219; influential=16; recognized venue; clinical/rehab relevance; BCI term matches=1; title BCI matches=1; open PDF metadata,954dc835b41f2484b166bfd1e6910c33f62ad03e,A New Gaze-BCI-Driven Control of an Upper Limb Exoskeleton for Rehabilitation in Real-World Tasks,"A. Frisoli, Claudio Loconsole, D. Leonardis, F. Banno, M. Barsotti, C. Chisari, et al.",IEEE Transactions on Systems Man and Cybernetics Part C (Applications and Reviews),2012-11-01,219,16,Rehabilitation and Neuroprosthetics,,10.1109/TSMCC.2012.2226444,,,https://doi.org/10.1109/TSMCC.2012.2226444,https://www.semanticscholar.org/paper/954dc835b41f2484b166bfd1e6910c33f62ad03e,,Computer Science; Engineering; Medicine,False,
2012,14,,14,172.578,citations=213; influential=6; recognized venue; BCI term matches=3; title BCI matches=2; open PDF metadata,986ccad3469c360c8500335ef53ea2beb95ca449,Proprioceptive Feedback and Brain Computer Interface (BCI) Based Neuroprostheses,"A. Ramos-Murguialday, M. Schürholz, V. Caggiano, M. Wildgruber, A. Caria, E. Hammer, et al.",PLoS ONE,2012-10-05,213,6,Motor Imagery and Movement Decoding,"Brain computer interface (BCI) technology has been proposed for motor neurorehabilitation, motor replacement and assistive technologies. It is an open question whether proprioceptive feedback affects the regulation of brain oscillations and therefore BCI control. We developed a BCI coupled on-line with a robotic hand exoskeleton for flexing and extending the fingers. 24 healthy participants performed five different tasks of closing and opening the hand: (1) motor imagery of the hand movement without any overt movement and without feedback, (2) motor imagery with movement as online feedback (participants see and feel their hand, with the exoskeleton moving according to their brain signals, (3) passive (the orthosis passively opens and closes the hand without imagery) and (4) active (overt) movement of the hand and rest. Performance was defined as the difference in power of the sensorimotor rhythm during motor task and rest and calculated offline for different tasks. Participants were divided in three groups depending on the feedback receiving during task 2 (the other tasks were the same for all participants). Group 1 (n = 9) received contingent positive feedback (participants' sensorimotor rhythm (SMR) desynchronization was directly linked to hand orthosis movements), group 2 (n = 8) contingent “negative” feedback (participants' sensorimotor rhythm synchronization was directly linked to hand orthosis movements) and group 3 (n = 7) sham feedback (no link between brain oscillations and orthosis movements). We observed that proprioceptive feedback (feeling and seeing hand movements) improved BCI performance significantly. Furthermore, in the contingent positive group only a significant motor learning effect was observed enhancing SMR desynchronization during motor imagery without feedback in time. Furthermore, we observed a significantly stronger SMR desynchronization in the contingent positive group compared to the other groups during active and passive movements. To summarize, we demonstrated that the use of contingent positive proprioceptive feedback BCI enhanced SMR desynchronization during motor tasks.",10.1371/journal.pone.0047048,,23071707,https://doi.org/10.1371/journal.pone.0047048,https://www.semanticscholar.org/paper/986ccad3469c360c8500335ef53ea2beb95ca449,https://journals.plos.org/plosone/article/file?id=10.1371/journal.pone.0047048&type=printable,Biology; Engineering; Medicine,False,
2012,15,,15,187.768,citations=211; influential=19; recognized venue; BCI term matches=2; title BCI matches=1; open PDF metadata,5be52c4ef3cb716fc71b92fee6eb41dd594bbdbf,A Brain-Computer Interface Based Attention Training Program for Treating Attention Deficit Hyperactivity Disorder,"C. Lim, Tih-Shih Lee, Cuntai Guan, D. Fung, Yudong Zhao, S. Teng, et al.",PLoS ONE,2012-10-24,211,19,EEG Signal Processing and Datasets,"Attention deficit hyperactivity disorder (ADHD) symptoms can be difficult to treat. We previously reported that a 20-session brain-computer interface (BCI) attention training programme improved ADHD symptoms. Here, we investigated a new more intensive BCI-based attention training game system on 20 unmedicated ADHD children (16 males, 4 females) with significant inattentive symptoms (combined and inattentive ADHD subtypes). This new system monitored attention through a head band with dry EEG sensors, which was used to drive a feed forward game. The system was calibrated for each user by measuring the EEG parameters during a Stroop task. Treatment consisted of an 8-week training comprising 24 sessions followed by 3 once-monthly booster training sessions. Following intervention, both parent-rated inattentive and hyperactive-impulsive symptoms on the ADHD Rating Scale showed significant improvement. At week 8, the mean improvement was −4.6 (5.9) and −4.7 (5.6) respectively for inattentive symptoms and hyperactive-impulsive symptoms (both p<0.01). Cohen’s d effect size for inattentive symptoms was large at 0.78 at week 8 and 0.84 at week 24 (post-boosters). Further analysis showed that the change in the EEG based BCI ADHD severity measure correlated with the change ADHD Rating Scale scores. The BCI-based attention training game system is a potential new treatment for ADHD. Trial Registration ClinicalTrials.gov NCT01344044",10.1371/journal.pone.0046692,,23115630,https://doi.org/10.1371/journal.pone.0046692,https://www.semanticscholar.org/paper/5be52c4ef3cb716fc71b92fee6eb41dd594bbdbf,https://journals.plos.org/plosone/article/file?id=10.1371/journal.pone.0046692&type=printable,Biology; Medicine; Psychology,False,
2012,16,,16,177.275,citations=204; influential=12; recognized venue; BCI term matches=2; open PDF metadata,7156e5d26933573f0c834553414b6ba09cd2393f,Transferring Subspaces Between Subjects in Brain--Computer Interfacing,"W. Samek, F. Meinecke, K. Müller",IEEE Transactions on Biomedical Engineering,2012-09-18,204,12,Motor Imagery and Movement Decoding,"Compensating changes between a subjects' training and testing session in brain-computer interfacing (BCI) is challenging but of great importance for a robust BCI operation. We show that such changes are very similar between subjects, and thus can be reliably estimated using data from other users and utilized to construct an invariant feature space. This novel approach to learning from other subjects aims to reduce the adverse effects of common nonstationarities, but does not transfer discriminative information. This is an important conceptual difference to standard multi-subject methods that, e.g., improve the covariance matrix estimation by shrinking it toward the average of other users or construct a global feature space. These methods do not reduces the shift between training and test data and may produce poor results when subjects have very different signal characteristics. In this paper, we compare our approach to two state-of-the-art multi-subject methods on toy data and two datasets of EEG recordings from subjects performing motor imagery. We show that it can not only achieve a significant increase in performance, but also that the extracted change patterns allow for a neurophysiologically meaningful interpretation.",10.1109/TBME.2013.2253608,1209.4115,23529075,https://doi.org/10.1109/TBME.2013.2253608,https://www.semanticscholar.org/paper/7156e5d26933573f0c834553414b6ba09cd2393f,http://arxiv.org/pdf/1209.4115,Computer Science; Mathematics; Medicine,False,
2012,17,,17,194.304,citations=191; influential=21; recognized venue; invasive/high-bandwidth BCI; BCI term matches=2; title BCI matches=2; open PDF metadata,c75a8b8555151df04541e63b9c23aeb7ebc31e7d,Online Adaptation of a c-VEP Brain-Computer Interface(BCI) Based on Error-Related Potentials and Unsupervised Learning,"M. Spüler, W. Rosenstiel, M. Bogdan",PLoS ONE,2012-12-07,191,21,"SSVEP, P300, and ERP Spellers","The goal of a Brain-Computer Interface (BCI) is to control a computer by pure brain activity. Recently, BCIs based on code-modulated visual evoked potentials (c-VEPs) have shown great potential to establish high-performance communication. In this paper we present a c-VEP BCI that uses online adaptation of the classifier to reduce calibration time and increase performance. We compare two different approaches for online adaptation of the system: an unsupervised method and a method that uses the detection of error-related potentials. Both approaches were tested in an online study, in which an average accuracy of 96% was achieved with adaptation based on error-related potentials. This accuracy corresponds to an average information transfer rate of 144 bit/min, which is the highest bitrate reported so far for a non-invasive BCI. In a free-spelling mode, the subjects were able to write with an average of 21.3 error-free letters per minute, which shows the feasibility of the BCI system in a normal-use scenario. In addition we show that a calibration of the BCI system solely based on the detection of error-related potentials is possible, without knowing the true class labels.",10.1371/journal.pone.0051077,,23236433,https://doi.org/10.1371/journal.pone.0051077,https://www.semanticscholar.org/paper/c75a8b8555151df04541e63b9c23aeb7ebc31e7d,https://journals.plos.org/plosone/article/file?id=10.1371/journal.pone.0051077&type=printable,Computer Science; Medicine,False,
2012,18,,18,171.381,citations=189; influential=9; recognized venue; BCI term matches=1; title BCI matches=1; open PDF metadata,fcf562d3342a89c200a1578e98bf86af39cf24f4,Improving the Separability of Motor Imagery EEG Signals Using a Cross Correlation-Based Least Square Support Vector Machine for Brain–Computer Interface,"S. Siuly, Yan Li",IEEE transactions on neural systems and rehabilitation engineering,2012-01-23,189,9,Motor Imagery and Movement Decoding,,10.1109/TNSRE.2012.2184838,,22287252,https://doi.org/10.1109/TNSRE.2012.2184838,https://www.semanticscholar.org/paper/fcf562d3342a89c200a1578e98bf86af39cf24f4,,Computer Science; Engineering; Medicine,False,
2012,19,,19,163.57,citations=188; influential=5; recognized venue; BCI term matches=2; title BCI matches=1; open PDF metadata,665e1f22a1f502e7472f6aacb446429332d0b455,Comparison of Dry and Gel Based Electrodes for P300 Brain–Computer Interfaces,"C. Guger, G. Krausz, B. Allison, G. Edlinger",Frontiers in Neuroscience,2012-03-26,188,5,"SSVEP, P300, and ERP Spellers","Most brain–computer interfaces (BCIs) rely on one of three types of signals in the electroencephalogram (EEG): P300s, steady-state visually evoked potentials, and event-related desynchronization. EEG is typically recorded non-invasively with electrodes mounted on the human scalp using conductive electrode gel for optimal impedance and data quality. The use of electrode gel entails serious problems that are especially pronounced in real-world settings when experts are not available. Some recent work has introduced dry electrode systems that do not require gel, but often introduce new problems such as comfort and signal quality. The principal goal of this study was to assess a new dry electrode BCI system in a very common task: spelling with a P300 BCI. A total of 23 subjects used a P300 BCI to spell the word “LUCAS” while receiving real-time, closed-loop feedback. The dry system yielded classification accuracies that were similar to those obtained with gel systems. All subjects completed a questionnaire after data recording, and all subjects stated that the dry system was not uncomfortable. This is the first field validation of a dry electrode P300 BCI system, and paves the way for new research and development with EEG recording systems that are much more practical and convenient in field settings than conventional systems.",10.3389/fnins.2012.00060,,22586362,https://doi.org/10.3389/fnins.2012.00060,https://www.semanticscholar.org/paper/665e1f22a1f502e7472f6aacb446429332d0b455,https://www.frontiersin.org/articles/10.3389/fnins.2012.00060/pdf,Computer Science; Engineering; Medicine,False,
