year,rank,candidateRank,selectionRank,importanceScore,importanceReasons,paperId,title,authors,venue,publicationDate,citationCount,influentialCitationCount,category,abstract,doi,arxiv,pubmed,url,semanticScholarUrl,openAccessPdf,fieldsOfStudy,candidate,githubUrl
2012,36,,36,149.846,citations=134; influential=7; BCI term matches=1; title BCI matches=1; open PDF metadata,667ab2dfe4ffbda11cda88d8057ae86ed444d020,A P300-based Quantitative Comparison between the Emotiv Epoc Headset and a Medical EEG Device,"M. Duvinage, T. Castermans, T. Dutoit, M. Petieau, T. Hoellinger, C. Saedeleer, et al.",BioMed,,134,7,"SSVEP, P300, and ERP Spellers",,10.2316/P.2012.764-071,,,https://doi.org/10.2316/P.2012.764-071,https://www.semanticscholar.org/paper/667ab2dfe4ffbda11cda88d8057ae86ed444d020,,Computer Science; Engineering; Medicine,False,
2012,37,,37,154.184,citations=130; influential=7; clinical/rehab relevance; BCI term matches=1; title BCI matches=1; open PDF metadata,b11fa380dcf867b864497e59017775ec78d8861f,Relationship Between Electrical Brain Responses to Motor Imagery and Motor Impairment in Stroke,"V. Kaiser, I. Daly, F. Pichiorri, D. Mattia, G. Müller-Putz, C. Neuper",Stroke,2012-10-01,130,7,Motor Imagery and Movement Decoding,,10.1161/STROKEAHA.112.665489,,22895995,https://doi.org/10.1161/STROKEAHA.112.665489,https://www.semanticscholar.org/paper/b11fa380dcf867b864497e59017775ec78d8861f,https://www.ahajournals.org/doi/pdf/10.1161/STROKEAHA.112.665489,Medicine,False,
2012,38,,38,140.215,citations=127; influential=4; BCI term matches=1; title BCI matches=1; open PDF metadata,8a924fd1c9428b1d7494e6f72f61f6c76b06f2be,The effect of distinct mental strategies on classification performance for brain-computer interfaces.,"E. V. Friedrich, Reinhold Scherer, C. Neuper",International Journal of Psychophysiology,2012-04-01,127,4,EEG Signal Processing and Datasets,,10.1016/j.ijpsycho.2012.01.014,,22289414,https://doi.org/10.1016/j.ijpsycho.2012.01.014,https://www.semanticscholar.org/paper/8a924fd1c9428b1d7494e6f72f61f6c76b06f2be,,Computer Science; Medicine; Psychology,False,
2012,39,,39,145.215,citations=121; influential=6; BCI term matches=1; title BCI matches=1; open PDF metadata,33b027b9c047f3fc79dc327ceacb8f81a9dfbca1,Behavioral and neural correlates of visuomotor adaptation observed through a brain-computer interface in primary motor cortex.,"S. Chase, R. Kass, A. Schwartz",Journal of Neurophysiology,2012-07-15,121,6,Motor Imagery and Movement Decoding,,10.1152/jn.00371.2011,,22496532,https://doi.org/10.1152/jn.00371.2011,https://www.semanticscholar.org/paper/33b027b9c047f3fc79dc327ceacb8f81a9dfbca1,https://www.ncbi.nlm.nih.gov/pmc/articles/PMC3404791,Computer Science; Medicine; Psychology,False,
2012,40,,40,167.259,citations=120; influential=5; recognized venue; dataset/benchmark; invasive/high-bandwidth BCI; BCI term matches=3; title BCI matches=2; open PDF metadata,b71c7ebb73b4ab09fcbb7f1dfbfbb4d72019752d,Multi-Class Motor Imagery EEG Decoding for Brain-Computer Interfaces,"Deng Wang, Duoqian Miao, Gunnar Blohm",Frontiers in Neuroscience,2012-10-09,120,5,Motor Imagery and Movement Decoding,"Recent studies show that scalp electroencephalography (EEG) as a non-invasive interface has great potential for brain-computer interfaces (BCIs). However, one factor that has limited practical applications for EEG-based BCI so far is the difficulty to decode brain signals in a reliable and efficient way. This paper proposes a new robust processing framework for decoding of multi-class motor imagery (MI) that is based on five main processing steps. (i) Raw EEG segmentation without the need of visual artifact inspection. (ii) Considering that EEG recordings are often contaminated not just by electrooculography (EOG) but also other types of artifacts, we propose to first implement an automatic artifact correction method that combines regression analysis with independent component analysis for recovering the original source signals. (iii) The significant difference between frequency components based on event-related (de-) synchronization and sample entropy is then used to find non-contiguous discriminating rhythms. After spectral filtering using the discriminating rhythms, a channel selection algorithm is used to select only relevant channels. (iv) Feature vectors are extracted based on the inter-class diversity and time-varying dynamic characteristics of the signals. (v) Finally, a support vector machine is employed for four-class classification. We tested our proposed algorithm on experimental data that was obtained from dataset 2a of BCI competition IV (2008). The overall four-class kappa values (between 0.41 and 0.80) were comparable to other models but without requiring any artifact-contaminated trial removal. The performance showed that multi-class MI tasks can be reliably discriminated using artifact-contaminated EEG recordings from a few channels. This may be a promising avenue for online robust EEG-based BCI applications.",10.3389/fnins.2012.00151,,23087607,https://doi.org/10.3389/fnins.2012.00151,https://www.semanticscholar.org/paper/b71c7ebb73b4ab09fcbb7f1dfbfbb4d72019752d,https://www.frontiersin.org/articles/10.3389/fnins.2012.00151/pdf,Computer Science; Engineering; Medicine,False,
2012,41,,41,147.259,citations=120; influential=5; clinical/rehab relevance; BCI term matches=1; title BCI matches=1; open PDF metadata,d9e41f5505c39be4282dcd21ad7c749ab292c474,EEG-based Brain-Computer Interface to support post-stroke motor rehabilitation of the upper limb,"F. Cincotti, F. Pichiorri, P. Aricó, F. Aloise, F. Leotta, F. D. Fallani, et al.",Annual International Conference of the IEEE Engineering in Medicine and Biology Society,2012-11-12,120,5,Motor Imagery and Movement Decoding,,10.1109/EMBC.2012.6346871,,23366832,https://doi.org/10.1109/EMBC.2012.6346871,https://www.semanticscholar.org/paper/d9e41f5505c39be4282dcd21ad7c749ab292c474,,Computer Science; Engineering; Medicine; Psychology,False,
2012,42,,42,140.948,citations=113; influential=5; BCI term matches=1; title BCI matches=1; open PDF metadata,e29e1b6252f5762cc3699968b80bcefa3f0d645a,Is It Significant? Guidelines for Reporting BCI Performance,"M. Billinger, I. Daly, V. Kaiser, Jing Jin, B. Allison, G. Müller-Putz, et al.",,,113,5,General BCI Methods and Systems,,10.1007/978-3-642-29746-5_17,,,https://doi.org/10.1007/978-3-642-29746-5_17,https://www.semanticscholar.org/paper/e29e1b6252f5762cc3699968b80bcefa3f0d645a,,Computer Science,False,
2012,43,,43,151.166,citations=113; influential=4; recognized venue; BCI term matches=2; title BCI matches=2; open PDF metadata,f281c79a22588e16357f1e3cad798773ec498063,EEG correlates of P300-based brain–computer interface (BCI) performance in people with amyotrophic lateral sclerosis,"J. Mak, D. McFarland, T. Vaughan, L. McCane, Phillippa Z Tsui, D. Zeitlin, et al.",Journal of Neural Engineering,2012-04-01,113,4,"SSVEP, P300, and ERP Spellers",,10.1088/1741-2560/9/2/026014,,22350501,https://doi.org/10.1088/1741-2560/9/2/026014,https://www.semanticscholar.org/paper/f281c79a22588e16357f1e3cad798773ec498063,,Medicine; Physics; Psychology,False,
2012,44,,44,134.971,citations=113; influential=2; clinical/rehab relevance; BCI term matches=2; title BCI matches=1; open PDF metadata,9c820b8e0fc010ec338250058d581a4057105b4d,From Spinal Central Pattern Generators to Cortical Network: Integrated BCI for Walking Rehabilitation,"G. Cheron, M. Duvinage, C. Saedeleer, T. Castermans, A. Bengoetxea, M. Petieau, et al.",Journal of Neural Transplantation and Plasticity,2012-01-04,113,2,Motor Imagery and Movement Decoding,"Success in locomotor rehabilitation programs can be improved with the use of brain-computer interfaces (BCIs). Although a wealth of research has demonstrated that locomotion is largely controlled by spinal mechanisms, the brain is of utmost importance in monitoring locomotor patterns and therefore contains information regarding central pattern generation functioning. In addition, there is also a tight coordination between the upper and lower limbs, which can also be useful in controlling locomotion. The current paper critically investigates different approaches that are applicable to this field: the use of electroencephalogram (EEG), upper limb electromyogram (EMG), or a hybrid of the two neurophysiological signals to control assistive exoskeletons used in locomotion based on programmable central pattern generators (PCPGs) or dynamic recurrent neural networks (DRNNs). Plantar surface tactile stimulation devices combined with virtual reality may provide the sensation of walking while in a supine position for use of training brain signals generated during locomotion. These methods may exploit mechanisms of brain plasticity and assist in the neurorehabilitation of gait in a variety of clinical conditions, including stroke, spinal trauma, multiple sclerosis, and cerebral palsy.",10.1155/2012/375148,,22272380,https://doi.org/10.1155/2012/375148,https://www.semanticscholar.org/paper/9c820b8e0fc010ec338250058d581a4057105b4d,https://downloads.hindawi.com/journals/np/2012/375148.pdf,Computer Science; Engineering; Medicine,False,
2012,45,,45,145.932,citations=112; influential=7; BCI term matches=1; title BCI matches=1; open PDF metadata,4e7325948c55f409fd0d1b5227f73359bdb99a3b,Evaluating the ergonomics of BCI devices for research and experimentation,"Joshua I. Ekandem, T. Davis, Ignacio Alvarez, Melva T. James, J. Gilbert",Ergonomics,2012-04-26,112,7,General BCI Methods and Systems,,10.1080/00140139.2012.662527,,22506831,https://doi.org/10.1080/00140139.2012.662527,https://www.semanticscholar.org/paper/4e7325948c55f409fd0d1b5227f73359bdb99a3b,,Computer Science; Engineering; Medicine,False,
2012,46,,46,163.029,citations=112; influential=6; recognized venue; clinical/rehab relevance; invasive/high-bandwidth BCI; BCI term matches=2; open PDF metadata,01e4cf86c6fea629bdd8e5c1f112cb7d1d9530ec,Decoding Intra-Limb and Inter-Limb Kinematics During Treadmill Walking From Scalp Electroencephalographic (EEG) Signals,"Alessandro Presacco, L. Forrester, J. Contreras-Vidal",IEEE transactions on neural systems and rehabilitation engineering,2012-03-01,112,6,Motor Imagery and Movement Decoding,"Brain-machine interface (BMI) research has largely been focused on the upper limb. Although restoration of gait function has been a long-standing focus of rehabilitation research, surprisingly very little has been done to decode the cortical neural networks involved in the guidance and control of bipedal locomotion. A notable exception is the work by Nicolelis' group at Duke University that decoded gait kinematics from chronic recordings from ensembles of neurons in primary sensorimotor areas in rhesus monkeys. Recently, we showed that gait kinematics from the ankle, knee, and hip joints during human treadmill walking can be inferred from the electroencephalogram (EEG) with decoding accuracies comparable to those using intracortical recordings. Here we show that both intra- and inter-limb kinematics from human treadmill walking can be achieved with high accuracy from as few as 12 electrodes using scalp EEG. Interestingly, forward and backward predictors from EEG signals lagging or leading the kinematics, respectively, showed different spatial distributions suggesting distinct neural networks for feedforward and feedback control of gait. Of interest is that average decoding accuracy across subjects and decoding modes was ~ 0.68±0.08, supporting the feasibility of EEG-based BMI systems for restoration of walking in patients with paralysis.",10.1109/TNSRE.2012.2188304,,22438336,https://doi.org/10.1109/TNSRE.2012.2188304,https://www.semanticscholar.org/paper/01e4cf86c6fea629bdd8e5c1f112cb7d1d9530ec,https://europepmc.org/articles/pmc3355189?pdf=render,Engineering; Medicine; Psychology,False,
2012,47,,47,153.035,citations=111; influential=11; BCI term matches=1; title BCI matches=1; open PDF metadata,e35864047f5b4ac3398ad6f242d2f1407c965f37,Semi-autonomous Car Control Using Brain Computer Interfaces,"D. Goehring, David Latotzky, Miao Wang, R. Rojas",Annual Meeting of the IEEE Industry Applications Society,,111,11,General BCI Methods and Systems,,10.1007/978-3-642-33932-5_37,,,https://doi.org/10.1007/978-3-642-33932-5_37,https://www.semanticscholar.org/paper/e35864047f5b4ac3398ad6f242d2f1407c965f37,,Computer Science; Engineering,False,
2012,48,,48,153.76,citations=108; influential=8; invasive/high-bandwidth BCI; BCI term matches=2; title BCI matches=1; open PDF metadata,0db2cc2e3bb7f4680b3eb88c2931f9513aee859d,"Automatic single-trial discrimination of mental arithmetic, mental singing and the no-control state from prefrontal activity: toward a three-state NIRS-BCI","S. Power, A. Kushki, T. Chau",BMC Research Notes,2012-03-13,108,8,Motor Imagery and Movement Decoding,"Near-infrared spectroscopy (NIRS) is an optical imaging technology that has recently been investigated for use in a safe, non-invasive brain-computer interface (BCI) for individuals with severe motor impairments. To date, most NIRS-BCI studies have attempted to discriminate two mental states (e.g., a mental task and rest), which could potentially lead to a two-choice BCI system. In this study, we attempted to automatically differentiate three mental states - specifically, intentional activity due to 1) a mental arithmetic (MA) task and 2) a mental singing (MS) task, and 3) an unconstrained, ""no-control (NC)"" state - to investigate the feasibility of a three-choice system-paced NIRS-BCI. Deploying a dual-wavelength frequency domain near-infrared spectrometer, we interrogated nine sites around the frontopolar locations while 7 able-bodied adults performed mental arithmetic and mental singing to answer multiple-choice questions within a system-paced paradigm. With a linear classifier trained on a ten-dimensional feature set, an overall classification accuracy of 56.2% was achieved for the MA vs. MS vs. NC classification problem and all individual participant accuracies significantly exceeded chance (i.e., 33%). However, as anticipated based on results of previous work, the three-class discrimination was unsuccessful for three participants due to the ineffectiveness of the mental singing task. Excluding these three participants increases the accuracy rate to 62.5%. Even without training, three of the remaining four participants achieved accuracies approaching 70%, the value often cited as being necessary for effective BCI communication. These results are encouraging and demonstrate the potential of a three-state system-paced NIRS-BCI with two intentional control states corresponding to mental arithmetic and mental singing.",10.1186/1756-0500-5-141,,22414111,https://doi.org/10.1186/1756-0500-5-141,https://www.semanticscholar.org/paper/0db2cc2e3bb7f4680b3eb88c2931f9513aee859d,https://bmcresnotes.biomedcentral.com/counter/pdf/10.1186/1756-0500-5-141,Computer Science; Engineering; Medicine,False,
2012,49,,49,165.176,citations=107; influential=12; recognized venue; BCI term matches=2; title BCI matches=1; open PDF metadata,0808cc9e3121f2119c10d6875405d3e13830522f,An online brain-computer interface based on shifting attention to concurrent streams of auditory stimuli,"N. Hill, Bernhard Schölkopf",Journal of Neural Engineering,2012-02-15,107,12,Motor Imagery and Movement Decoding,"We report on the development and online testing of an electroencephalogram-based brain–computer interface (BCI) that aims to be usable by completely paralysed users—for whom visual or motor-system-based BCIs may not be suitable, and among whom reports of successful BCI use have so far been very rare. The current approach exploits covert shifts of attention to auditory stimuli in a dichotic-listening stimulus design. To compare the efficacy of event-related potentials (ERPs) and steady-state auditory evoked potentials (SSAEPs), the stimuli were designed such that they elicited both ERPs and SSAEPs simultaneously. Trial-by-trial feedback was provided online, based on subjects' modulation of N1 and P3 ERP components measured during single 5 s stimulation intervals. All 13 healthy subjects were able to use the BCI, with performance in a binary left/right choice task ranging from 75% to 96% correct across subjects (mean 85%). BCI classification was based on the contrast between stimuli in the attended stream and stimuli in the unattended stream, making use of every stimulus, rather than contrasting frequent standard and rare ‘oddball’ stimuli. SSAEPs were assessed offline: for all subjects, spectral components at the two exactly known modulation frequencies allowed discrimination of pre-stimulus from stimulus intervals, and of left-only stimuli from right-only stimuli when one side of the dichotic stimulus pair was muted. However, attention modulation of SSAEPs was not sufficient for single-trial BCI communication, even when the subject's attention was clearly focused well enough to allow classification of the same trials via ERPs. ERPs clearly provided a superior basis for BCI. The ERP results are a promising step towards the development of a simple-to-use, reliable yes/no communication system for users in the most severely paralysed states, as well as potential attention-monitoring and -training applications outside the context of assistive technology.",10.1088/1741-2560/9/2/026011,,22333135,https://doi.org/10.1088/1741-2560/9/2/026011,https://www.semanticscholar.org/paper/0808cc9e3121f2119c10d6875405d3e13830522f,https://europepmc.org/articles/pmc3366495?pdf=render,Computer Science; Engineering; Medicine; Physics; Psychology,False,
2012,50,,50,126.871,citations=105; influential=2; BCI term matches=1; title BCI matches=1; open PDF metadata,1a780c54a507f5ab2db56ff02b907a6f2632bf73,Brain computer interface control via functional connectivity dynamics,"I. Daly, S. Nasuto, K. Warwick",Pattern Recognition,2012-06-01,105,2,General BCI Methods and Systems,,10.1016/j.patcog.2011.04.034,,,https://doi.org/10.1016/j.patcog.2011.04.034,https://www.semanticscholar.org/paper/1a780c54a507f5ab2db56ff02b907a6f2632bf73,,Computer Science,False,
2012,51,,51,149.839,citations=103; influential=10; BCI term matches=1; title BCI matches=1; open PDF metadata,789c3670d9ed546ee76b795aced9dd824db49057,Comparison of a row-column speller vs. a novel lateral single-character speller: assessment of BCI for severe motor disabled patients.,"G. Pires, U. Nunes, M. Castelo‐Branco",Clinical Neurophysiology,2012-06-01,103,10,Motor Imagery and Movement Decoding,,10.1016/j.clinph.2011.10.040,,22244868,https://doi.org/10.1016/j.clinph.2011.10.040,https://www.semanticscholar.org/paper/789c3670d9ed546ee76b795aced9dd824db49057,,Medicine; Psychology,False,
2012,52,,52,140.917,citations=102; influential=3; recognized venue; BCI term matches=2; open PDF metadata,a30b26a68615989747f212fb64de6c383da7ba46,Online detection of error-related potentials boosts the performance of mental typewriters,"Nico M. Schmidt, B. Blankertz, M. Treder",BMC Neuroscience,2012-02-15,102,3,Motor Imagery and Movement Decoding,"Increasing the communication speed of brain-computer interfaces (BCIs) is a major aim of current BCI-research. The idea to automatically detect error-related potentials (ErrPs) in order to veto erroneous decisions of a BCI has been existing for more than one decade, but this approach was so far little investigated in online mode. In our study with eleven participants, an ErrP detection mechanism was implemented in an electroencephalography (EEG) based gaze-independent visual speller. Single-trial ErrPs were detected with a mean accuracy of 89.1% (AUC 0.90). The spelling speed was increased on average by 49.0% using ErrP detection. The improvement in spelling speed due to error detection was largest for participants with low spelling accuracy. The performance of BCIs can be increased by using an automatic error detection mechanism. The benefit for patients with motor disorders is potentially high since they often have rather low spelling accuracies compared to healthy people.",10.1186/1471-2202-13-19,,22336293,https://doi.org/10.1186/1471-2202-13-19,https://www.semanticscholar.org/paper/a30b26a68615989747f212fb64de6c383da7ba46,https://bmcneurosci.biomedcentral.com/counter/pdf/10.1186/1471-2202-13-19,Computer Science; Medicine; Psychology,False,
2012,53,,53,159.299,citations=101; influential=8; recognized venue; BCI term matches=2; title BCI matches=2; open PDF metadata,e6b0836307e118b3275948424ba8885eb94b99b3,A combined brain-computer interface based on P300 potentials and motion-onset visual evoked potentials.,"Jing Jin, B. Allison, Xingyu Wang, C. Neuper",Journal of Neuroscience Methods,2012-04-15,101,8,"SSVEP, P300, and ERP Spellers",,10.1016/j.jneumeth.2012.01.004,,22269596,https://doi.org/10.1016/j.jneumeth.2012.01.004,https://www.semanticscholar.org/paper/e6b0836307e118b3275948424ba8885eb94b99b3,,Computer Science; Medicine,False,
2012,54,,54,143.679,citations=101; influential=7; BCI term matches=1; title BCI matches=1; open PDF metadata,eac92d746daf3713550f77926565c43a0e5d8c3c,Towards Practical Brain-Computer Interfaces: Bridging the Gap from Research to Real-World Applications,"B. Allison, Stephen Dunne, R. Leeb, J. D. R. Milln, A. Nijholt",,2012-08-22,101,7,General BCI Methods and Systems,,10.1007/978-3-642-29746-5,,,https://doi.org/10.1007/978-3-642-29746-5,https://www.semanticscholar.org/paper/eac92d746daf3713550f77926565c43a0e5d8c3c,,Computer Science; Engineering; Medicine,False,
2012,55,,55,130.097,citations=96; influential=3; BCI term matches=1; title BCI matches=1; open PDF metadata,735936a0a7bf7b05d0ed8423460fecbe05876d6e,Visual evoked potential-based brain-machine interface applications to assist disabled people,"J. L. S. Blasco, E. Iáñez, A. Úbeda, J. Azorín",Expert systems with applications,2012-07-01,96,3,"SSVEP, P300, and ERP Spellers",,10.1016/j.eswa.2012.01.110,,,https://doi.org/10.1016/j.eswa.2012.01.110,https://www.semanticscholar.org/paper/735936a0a7bf7b05d0ed8423460fecbe05876d6e,,Computer Science; Engineering; Medicine,False,
2012,56,,56,159.181,citations=93; influential=11; recognized venue; BCI term matches=1; title BCI matches=1; open PDF metadata,20bb206da3b51530d228b34993447104fe7db935,Sparse representation-based classification scheme for motor imagery-based brain–computer interface systems,"Younghak Shin, Seungchan Lee, Junho Lee, Heung-no Lee",Journal of Neural Engineering,2012-10-01,93,11,Motor Imagery and Movement Decoding,,10.1088/1741-2560/9/5/056002,,22872668,https://doi.org/10.1088/1741-2560/9/5/056002,https://www.semanticscholar.org/paper/20bb206da3b51530d228b34993447104fe7db935,,Computer Science; Engineering; Medicine; Physics,False,
2012,57,,57,151.687,citations=92; influential=4; recognized venue; dataset/benchmark; BCI term matches=2; title BCI matches=2; open PDF metadata,4821003482e5f4ddf61384ea1676b4e2335cfea0,A Bayesian Model for Exploiting Application Constraints to Enable Unsupervised Training of a P300-based BCI,"Pieter-Jan Kindermans, D. Verstraeten, B. Schrauwen",PLoS ONE,2012-04-04,92,4,"SSVEP, P300, and ERP Spellers","This work introduces a novel classifier for a P300-based speller, which, contrary to common methods, can be trained entirely unsupervisedly using an Expectation Maximization approach, eliminating the need for costly dataset collection or tedious calibration sessions. We use publicly available datasets for validation of our method and show that our unsupervised classifier performs competitively with supervised state-of-the-art spellers. Finally, we demonstrate the added value of our method in different experimental settings which reflect realistic usage situations of increasing difficulty and which would be difficult or impossible to tackle with existing supervised or adaptive methods.",10.1371/journal.pone.0033758,,22496763,https://doi.org/10.1371/journal.pone.0033758,https://www.semanticscholar.org/paper/4821003482e5f4ddf61384ea1676b4e2335cfea0,https://journals.plos.org/plosone/article/file?id=10.1371/journal.pone.0033758&type=printable,Computer Science; Medicine,False,
2012,58,,58,126.216,citations=90; influential=1; recognized venue; BCI term matches=1; title BCI matches=1; open PDF metadata,27197115f2a3740a5108bd4bcb67b3de32cd5d53,Neural population partitioning and a concurrent brain-machine interface for sequential motor function,"M. Shanechi, R. Hu, Marissa E. Powers, G. Wornell, E. Brown, Ziv M. Williams",Nature Neuroscience,2012-11-01,90,1,Motor Imagery and Movement Decoding,"Although brain-machine interfaces (BMIs) have focused largely on performing single-targeted movements, many natural tasks involve planning a complete sequence of such movements before execution. For these tasks, a BMI that can concurrently decode the full planned sequence before its execution may also consider the higher-level goal of the task to reformulate and perform it more effectively. Using population-wide modeling, we discovered two distinct subpopulations of neurons in the rhesus monkey premotor cortex that allow two planned targets of a sequential movement to be simultaneously held in working memory without degradation. Such marked stability occurred because each subpopulation encoded either only currently held or only newly added target information irrespective of the exact sequence. On the basis of these findings, we developed a BMI that concurrently decodes a full motor sequence in advance of movement and can then accurately execute it as desired.",10.1038/nn.3250,,23143511,https://doi.org/10.1038/nn.3250,https://www.semanticscholar.org/paper/27197115f2a3740a5108bd4bcb67b3de32cd5d53,https://europepmc.org/articles/pmc3509235?pdf=render,Computer Science; Medicine,False,
