year,rank,candidateRank,selectionRank,importanceScore,importanceReasons,paperId,title,authors,venue,publicationDate,citationCount,influentialCitationCount,category,abstract,doi,arxiv,pubmed,url,semanticScholarUrl,openAccessPdf,fieldsOfStudy,candidate,githubUrl,keywordTags,keyIdea,strengths,limitations,methodTags,paperLink
2008,1,,1,260.477,citations=1456; influential=203; BCI term matches=1; title BCI matches=1; open PDF metadata,ab6a90f44f0fe280f6207981bb62beb88602281e,Filter Bank Common Spatial Pattern (FBCSP) in Brain-Computer Interface,"K. Ang, Z. Y. Chin, Haihong Zhang, Cuntai Guan",IEEE World Congress on Computational Intelligence,2008-06-01,1456,203,General BCI Methods and Systems,,10.1109/IJCNN.2008.4634130,,,https://doi.org/10.1109/ijcnn.2008.4634130,https://www.semanticscholar.org/paper/ab6a90f44f0fe280f6207981bb62beb88602281e,,Computer Science; Engineering,False,,non-invasive,Positions Filter Bank Common Spatial Pattern (FBCSP) in Brain-Computer Interface within General BCI Methods and Systems.,"high citation signal (1,456); influential citation signal (203)","Broad BCI system claims often need stronger standardized evaluation across users, sessions, and devices.; Laboratory performance may not transfer to everyday usability, safety, and maintenance conditions.; Non-invasive signals are vulnerable to low signal-to-noise ratio, artifacts, and electrode setup variability.",BCI method,https://doi.org/10.1109/ijcnn.2008.4634130
2008,2,,2,227.924,citations=1144; influential=33; clinical/rehab relevance; BCI term matches=1; title BCI matches=1; open PDF metadata,32f297c1f61a6ac305d841c98b4a07b9db90a27d,Brain-computer interfaces in neurological rehabilitation.,"J. Daly, J. Wolpaw",Lancet Neurology,2008-11-01,1144,33,Rehabilitation and Neuroprosthetics,,10.1016/S1474-4422(08)70223-0,,18835541,https://doi.org/10.1016/s1474-4422(08)70223-0,https://www.semanticscholar.org/paper/32f297c1f61a6ac305d841c98b4a07b9db90a27d,,Computer Science; Engineering; Medicine; Psychology,False,,human,Positions Brain-computer interfaces in neurological rehabilitation. within Rehabilitation and Neuroprosthetics.,"high citation signal (1,144); influential citation signal (33)","Clinical impact needs stronger longitudinal evidence on daily function, adherence, and adverse events.; Clinical cohorts are often small and heterogeneous, making functional effect sizes difficult to compare.; Short follow-up windows can miss whether gains transfer to daily activities.",clinical/rehab,https://doi.org/10.1016/s1474-4422(08)70223-0
2008,3,,3,255.345,citations=944; influential=122; recognized venue; BCI term matches=2; title BCI matches=2; open PDF metadata,0b4668462903d782699bfb5d0b124cbc0f222d84,An efficient P300-based brain-computer interface for disabled subjects.,"Ulrich Hoffmann, J. Vesin, T. Ebrahimi, K. Diserens",Journal of Neuroscience Methods,2008-01-15,944,122,"SSVEP, P300, and ERP Spellers",,10.1016/J.JNEUMETH.2007.03.005,,17445904,https://doi.org/10.1016/j.jneumeth.2007.03.005,https://www.semanticscholar.org/paper/0b4668462903d782699bfb5d0b124cbc0f222d84,,Computer Science; Engineering; Medicine,False,,non-invasive; human; SSVEP; P300,"Positions An efficient P300-based brain-computer interface for disabled subjects. within SSVEP, P300, and ERP Spellers.",high citation signal (944); influential citation signal (122); recognized venue,"Visual spellers can be constrained by gaze dependence, stimulus comfort, and fatigue during long sessions.; Controlled target layouts and calibration conditions may not transfer to everyday communication.; Non-invasive signals are vulnerable to low signal-to-noise ratio, artifacts, and electrode setup variability.",BCI method,https://doi.org/10.1016/j.jneumeth.2007.03.005
2008,4,,4,230.885,citations=811; influential=60; dataset/benchmark; BCI term matches=1; title BCI matches=1; open PDF metadata,9031aac7e9b6adae909ce22fa35fa74ec52a52ec,BCI Competition 2008 { Graz data set B,"R. Leeb, C. Brunner",,,811,60,General BCI Methods and Systems,,,,,https://www.semanticscholar.org/paper/9031aac7e9b6adae909ce22fa35fa74ec52a52ec,https://www.semanticscholar.org/paper/9031aac7e9b6adae909ce22fa35fa74ec52a52ec,,Computer Science,False,,non-invasive,Positions BCI Competition 2008 { Graz data set B within General BCI Methods and Systems.,high citation signal (811); influential citation signal (60),"Benchmark value depends on standardized protocols, transparent splits, and external replication.; Broad BCI system claims often need stronger standardized evaluation across users, sessions, and devices.; Laboratory performance may not transfer to everyday usability, safety, and maintenance conditions.",dataset/benchmark,https://www.semanticscholar.org/paper/9031aac7e9b6adae909ce22fa35fa74ec52a52ec
2008,5,,5,214.36,citations=703; influential=28; invasive/high-bandwidth BCI; BCI term matches=1; title BCI matches=1; open PDF metadata,4f751de81cd438a56f18a9b153acaddd464f1100,A brain-actuated wheelchair: asynchronous and non-invasive Brain-computer interfaces for continuous control of robots.,"F. Galán, F. Galán, M. Nuttin, Eileen Lew, P. Ferrez, G. Vanacker, et al.",Clinical Neurophysiology,2008-09-01,703,28,Invasive and Implantable Interfaces,,10.1016/j.clinph.2008.06.001,,18621580,https://doi.org/10.1016/j.clinph.2008.06.001,https://www.semanticscholar.org/paper/4f751de81cd438a56f18a9b153acaddd464f1100,,Computer Science; Engineering; Medicine,False,,invasive; non-invasive,Positions A brain-actuated wheelchair: asynchronous and non-invasive Brain-computer interfaces for continuous control of robots. within Invasive and Implantable Interfaces.,high citation signal (703); influential citation signal (28),"Surgical risk, device durability, and long-term signal stability constrain clinical translation.; Small participant cohorts make headline decoding performance difficult to generalize.; Non-invasive signals are vulnerable to low signal-to-noise ratio, artifacts, and electrode setup variability.",invasive,https://doi.org/10.1016/j.clinph.2008.06.001
2008,6,,6,204.985,citations=666; influential=19; BCI term matches=2; title BCI matches=2; open PDF metadata,f7014b2240699af3005da2915eba8acfb62aade8,A P300-based brain-computer interface for people with amyotrophic lateral sclerosis.,"F. Nijboer, E. Sellers, J. Mellinger, M. Jordan, Tamara Matuz, A. Furdea, et al.",Clinical Neurophysiology,2008-08-01,666,19,"SSVEP, P300, and ERP Spellers",,10.1016/j.clinph.2008.03.034,,18571984,https://doi.org/10.1016/j.clinph.2008.03.034,https://www.semanticscholar.org/paper/f7014b2240699af3005da2915eba8acfb62aade8,,Medicine; Psychology,False,,non-invasive; SSVEP; P300,"Positions A P300-based brain-computer interface for people with amyotrophic lateral sclerosis. within SSVEP, P300, and ERP Spellers.",high citation signal (666); influential citation signal (19),"Visual spellers can be constrained by gaze dependence, stimulus comfort, and fatigue during long sessions.; Controlled target layouts and calibration conditions may not transfer to everyday communication.; Non-invasive signals are vulnerable to low signal-to-noise ratio, artifacts, and electrode setup variability.",BCI method,https://doi.org/10.1016/j.clinph.2008.03.034
2008,7,,7,218.45,citations=619; influential=34; clinical/rehab relevance; BCI term matches=2; title BCI matches=2; open PDF metadata,0eee8c8c8aef66dc5b05d22c2aae68b013e6f874,Think to Move: a Neuromagnetic Brain-Computer Interface (BCI) System for Chronic Stroke,"Ethan R. Buch, Cornelia Weber, L. Cohen, C. Braun, M. Dimyan, T. Ard, et al.",Stroke,2008-03-01,619,34,Rehabilitation and Neuroprosthetics,,10.1161/STROKEAHA.107.505313,,18258825,https://doi.org/10.1161/strokeaha.107.505313,https://www.semanticscholar.org/paper/0eee8c8c8aef66dc5b05d22c2aae68b013e6f874,,Engineering; Medicine,False,,human,Positions Think to Move: a Neuromagnetic Brain-Computer Interface (BCI) System for Chronic Stroke within Rehabilitation and Neuroprosthetics.,high citation signal (619); influential citation signal (34),"Clinical impact needs stronger longitudinal evidence on daily function, adherence, and adverse events.; Clinical cohorts are often small and heterogeneous, making functional effect sizes difficult to compare.; Short follow-up windows can miss whether gains transfer to daily activities.",clinical/rehab,https://doi.org/10.1161/strokeaha.107.505313
2008,8,,8,209.039,citations=610; influential=15; recognized venue; BCI term matches=2; title BCI matches=2; open PDF metadata,b2451d7a84477eee22825c565ba42c0597828575,Control of an Electrical Prosthesis With an SSVEP-Based BCI,"G. Müller-Putz, G. Pfurtscheller",IEEE Transactions on Biomedical Engineering,,610,15,"SSVEP, P300, and ERP Spellers",,10.1109/TBME.2007.897815,,18232384,https://doi.org/10.1109/tbme.2007.897815,https://www.semanticscholar.org/paper/b2451d7a84477eee22825c565ba42c0597828575,,Computer Science; Engineering; Medicine,False,,non-invasive; SSVEP; P300,"Positions Control of an Electrical Prosthesis With an SSVEP-Based BCI within SSVEP, P300, and ERP Spellers.",high citation signal (610); influential citation signal (15); recognized venue,"Visual spellers can be constrained by gaze dependence, stimulus comfort, and fatigue during long sessions.; Controlled target layouts and calibration conditions may not transfer to everyday communication.; Non-invasive signals are vulnerable to low signal-to-noise ratio, artifacts, and electrode setup variability.",BCI method,https://doi.org/10.1109/tbme.2007.897815
2008,9,,9,241.637,citations=535; influential=86; recognized venue; dataset/benchmark; BCI term matches=2; title BCI matches=2; open PDF metadata,cd7d1f2568b9064800547f664d02c6e20f80d483,BCI Competition III: Dataset II- Ensemble of SVMs for BCI P300 Speller,"A. Rakotomamonjy, Vincent Guigue",IEEE Transactions on Biomedical Engineering,2008-02-15,535,86,"SSVEP, P300, and ERP Spellers",,10.1109/TBME.2008.915728,,18334407,https://doi.org/10.1109/tbme.2008.915728,https://www.semanticscholar.org/paper/cd7d1f2568b9064800547f664d02c6e20f80d483,,Computer Science; Medicine,False,,non-invasive; SSVEP; P300,"Positions BCI Competition III: Dataset II- Ensemble of SVMs for BCI P300 Speller within SSVEP, P300, and ERP Spellers.",high citation signal (535); influential citation signal (86); recognized venue,"Benchmark value depends on standardized protocols, transparent splits, and external replication.; Communication systems must still balance accuracy, latency, vocabulary size, privacy, and user autonomy.; Visual spellers can be constrained by gaze dependence, stimulus comfort, and fatigue during long sessions.",dataset/benchmark; communication,https://doi.org/10.1109/tbme.2008.915728
2008,10,,10,220.243,citations=467; influential=37; review/survey; clinical/rehab relevance; BCI term matches=3; title BCI matches=1; open PDF metadata,4af4440c2d8dbd31a3d4a06aabbcb0042b7caf4e,Brain-Computer Interfaces and communication in paralysis: extinction of goal directed thinking in completely paralysed patients?,"A. Kübler, Niels Birbaumer, Niels Birbaumer",Clinical Neurophysiology,2008-09-27,467,37,Motor Imagery and Movement Decoding,"Objective To investigate the relationship between physical impairment and brain-computer interface (BCI) performance. Method We present a meta-analysis of 29 patients with amyotrophic lateral sclerosis and 6 with other severe neurological diseases in different stages of physical impairment who were trained with a BCI. In most cases voluntary regulation of slow cortical potentials has been used as input signal for BCI control. More recently sensorimotor rhythms and the P300 event-related brain potential were recorded. Results A strong correlation has been found between physical impairment and BCI performance, indicating that performance worsens as impairment increases. Seven patients were in the complete locked-in state (CLIS) with no communication possible. After removal of these patients from the analysis, the relationship between physical impairment and BCI performance disappeared. The lack of a relation between physical impairment and BCI performance was confirmed when adding BCI data of patients from other BCI research groups. Conclusions Basic communication (yes/no) was not restored in any of the CLIS patients with a BCI. Whether locked-in patients can transfer learned brain control to the CLIS remains an open empirical question. Significance Voluntary brain regulation for communication is possible in all stages of paralysis except the CLIS.",10.1016/j.clinph.2008.06.019,,18824406,https://doi.org/10.1016/j.clinph.2008.06.019,https://www.semanticscholar.org/paper/4af4440c2d8dbd31a3d4a06aabbcb0042b7caf4e,,Medicine; Psychology,False,,non-invasive; human; SMR; P300,Objective To investigate the relationship between physical impairment and brain-computer interface (BCI) performance.,high citation signal (467); influential citation signal (37),"Review-level synthesis cannot resolve study quality differences, protocol bias, or reproducibility gaps.; Clinical impact needs stronger longitudinal evidence on daily function, adherence, and adverse events.; Communication systems must still balance accuracy, latency, vocabulary size, privacy, and user autonomy.",review; clinical/rehab; communication,https://doi.org/10.1016/j.clinph.2008.06.019
2008,11,,11,194.291,citations=428; influential=22; BCI term matches=1; title BCI matches=1; open PDF metadata,3d4b7ece3ac9ef57c35445e1977b8a979113251e,Brain-Computer Interfaces Based on Visual Evoked Potentials,"Yijun Wang, Xiaorong Gao, Bo Hong, Chuan Jia, Shangkai Gao",IEEE Engineering in Medicine and Biology Magazine,2008-09-16,428,22,"SSVEP, P300, and ERP Spellers",,10.1109/MEMB.2008.923958,,18799392,https://doi.org/10.1109/memb.2008.923958,https://www.semanticscholar.org/paper/3d4b7ece3ac9ef57c35445e1977b8a979113251e,,Computer Science; Engineering; Medicine,False,,non-invasive; SSVEP; P300,"Positions Brain-Computer Interfaces Based on Visual Evoked Potentials within SSVEP, P300, and ERP Spellers.",high citation signal (428); influential citation signal (22),"Visual spellers can be constrained by gaze dependence, stimulus comfort, and fatigue during long sessions.; Controlled target layouts and calibration conditions may not transfer to everyday communication.; Non-invasive signals are vulnerable to low signal-to-noise ratio, artifacts, and electrode setup variability.",BCI method,https://doi.org/10.1109/memb.2008.923958
2008,12,,12,207.29,citations=404; influential=23; recognized venue; BCI term matches=2; title BCI matches=2; open PDF metadata,309daaa71501f1a11a854602df9f605033bd3d83,An auditory brain-computer interface (BCI).,"F. Nijboer, A. Furdea, I. Gunst, J. Mellinger, D. McFarland, N. Birbaumer, et al.",Journal of Neuroscience Methods,2008-01-15,404,23,General BCI Methods and Systems,,10.1016/J.JNEUMETH.2007.02.009,,17399797,https://doi.org/10.1016/j.jneumeth.2007.02.009,https://www.semanticscholar.org/paper/309daaa71501f1a11a854602df9f605033bd3d83,https://www.ncbi.nlm.nih.gov/pmc/articles/PMC7955811,Medicine; Psychology,False,,non-invasive,Positions An auditory brain-computer interface (BCI). within General BCI Methods and Systems.,high citation signal (404); influential citation signal (23); recognized venue,"Broad BCI system claims often need stronger standardized evaluation across users, sessions, and devices.; Laboratory performance may not transfer to everyday usability, safety, and maintenance conditions.; Non-invasive signals are vulnerable to low signal-to-noise ratio, artifacts, and electrode setup variability.",BCI method,https://doi.org/10.1016/j.jneumeth.2007.02.009
2008,13,,13,185.718,citations=390; influential=15; BCI term matches=1; title BCI matches=1; open PDF metadata,67a35cecedb912e013726b8ec1d4b25cb8c0ba0c,"Brain-Computer Interfaces, Virtual Reality, and Videogames","A. Lécuyer, F. Lotte, R. Reilly, R. Leeb, M. Hirose, M. Slater",Computer,2008-10-01,390,15,General BCI Methods and Systems,,10.1109/MC.2008.410,,,https://doi.org/10.1109/mc.2008.410,https://www.semanticscholar.org/paper/67a35cecedb912e013726b8ec1d4b25cb8c0ba0c,,Computer Science; Engineering,False,,non-invasive,"Positions Brain-Computer Interfaces, Virtual Reality, and Videogames within General BCI Methods and Systems.",high citation signal (390); influential citation signal (15),"Broad BCI system claims often need stronger standardized evaluation across users, sessions, and devices.; Laboratory performance may not transfer to everyday usability, safety, and maintenance conditions.; Non-invasive signals are vulnerable to low signal-to-noise ratio, artifacts, and electrode setup variability.",BCI method,https://doi.org/10.1109/mc.2008.410
2008,14,,14,180.587,citations=366; influential=12; BCI term matches=1; title BCI matches=1; open PDF metadata,741dc3de86df198fc4d7270f1885e064fafcd85d,EEG feature extraction based on wavelet packet decomposition for brain computer interface,"Wu Ting, Guo-zheng Yan, Banghua Yang, Sun Hong",,2008-07-01,366,12,EEG Signal Processing and Datasets,,10.1016/J.MEASUREMENT.2007.07.007,,,https://doi.org/10.1016/j.measurement.2007.07.007,https://www.semanticscholar.org/paper/741dc3de86df198fc4d7270f1885e064fafcd85d,,Computer Science; Medicine,False,,non-invasive,Positions EEG feature extraction based on wavelet packet decomposition for brain computer interface within EEG Signal Processing and Datasets.,high citation signal (366); influential citation signal (12),"Dataset and preprocessing choices can bias comparisons across algorithms and laboratories.; Artifact robustness and sensor-setup variability need stronger external validation.; Non-invasive signals are vulnerable to low signal-to-noise ratio, artifacts, and electrode setup variability.",BCI method,https://doi.org/10.1016/j.measurement.2007.07.007
2008,15,,15,190.83,citations=353; influential=23; BCI term matches=1; title BCI matches=1; open PDF metadata,2a5fa501b90e106e741c705548b080668ed99703,Towards an independent brain-computer interface using steady state visual evoked potentials.,"B. Allison, D. McFarland, G. Schalk, S. Zheng, M. Jackson, J. Wolpaw",Clinical Neurophysiology,2008-02-01,353,23,"SSVEP, P300, and ERP Spellers",,10.1016/J.CLINPH.2007.09.121,,18077208,https://doi.org/10.1016/j.clinph.2007.09.121,https://www.semanticscholar.org/paper/2a5fa501b90e106e741c705548b080668ed99703,,Computer Science; Engineering; Medicine; Psychology,False,,non-invasive; SSVEP; P300,"Positions Towards an independent brain-computer interface using steady state visual evoked potentials. within SSVEP, P300, and ERP Spellers.",high citation signal (353); influential citation signal (23),"Visual spellers can be constrained by gaze dependence, stimulus comfort, and fatigue during long sessions.; Controlled target layouts and calibration conditions may not transfer to everyday communication.; Non-invasive signals are vulnerable to low signal-to-noise ratio, artifacts, and electrode setup variability.",BCI method,https://doi.org/10.1016/j.clinph.2007.09.121
2008,16,,16,192.406,citations=339; influential=12; recognized venue; BCI term matches=2; title BCI matches=2; open PDF metadata,deb5b5b7cbc6e542b4334854be9efcd9d360b784,The Berlin Brain-Computer Interface: Accurate performance from first-session in BCI-naive subjects,"B. Blankertz, F. Losch, M. Krauledat, G. Dornhege, G. Curio, K. Müller",IEEE Transactions on Biomedical Engineering,2008-04-11,339,12,General BCI Methods and Systems,,10.1109/TBME.2008.923152,,18838371,https://doi.org/10.1109/tbme.2008.923152,https://www.semanticscholar.org/paper/deb5b5b7cbc6e542b4334854be9efcd9d360b784,,Computer Science; Engineering; Medicine,False,,human,Positions The Berlin Brain-Computer Interface: Accurate performance from first-session in BCI-naive subjects within General BCI Methods and Systems.,high citation signal (339); influential citation signal (12); recognized venue,"Broad BCI system claims often need stronger standardized evaluation across users, sessions, and devices.; Laboratory performance may not transfer to everyday usability, safety, and maintenance conditions.; Participant variability can limit generalization across age, ability, disease status, and training experience.",BCI method,https://doi.org/10.1109/tbme.2008.923152
2008,17,,17,189.183,citations=339; influential=9; recognized venue; invasive/high-bandwidth BCI; BCI term matches=1; title BCI matches=1; open PDF metadata,939dc78d3d49b95e2e1c48f8ac0b1aaef1c60935,Non-invasive brain-computer interface system: towards its application as assistive technology.,"F. Cincotti, D. Mattia, F. Aloise, S. Bufalari, G. Schalk, G. Oriolo, et al.",Brain Research Bulletin,2008-04-15,339,9,Invasive and Implantable Interfaces,,10.1016/j.brainresbull.2008.01.007,,18394526,https://doi.org/10.1016/j.brainresbull.2008.01.007,https://www.semanticscholar.org/paper/939dc78d3d49b95e2e1c48f8ac0b1aaef1c60935,,Engineering; Medicine; Psychology,False,,invasive; non-invasive,Positions Non-invasive brain-computer interface system: towards its application as assistive technology. within Invasive and Implantable Interfaces.,high citation signal (339); recognized venue,"Surgical risk, device durability, and long-term signal stability constrain clinical translation.; Small participant cohorts make headline decoding performance difficult to generalize.; Non-invasive signals are vulnerable to low signal-to-noise ratio, artifacts, and electrode setup variability.",invasive,https://doi.org/10.1016/j.brainresbull.2008.01.007
2008,18,,18,199.35,citations=309; influential=25; recognized venue; BCI term matches=1; title BCI matches=1; open PDF metadata,0bfaaefcb8afe5431f1a22289aa4dec1b2d2c0cb,Functional network reorganization during learning in a brain-computer interface paradigm,"B. Jarosiewicz, S. Chase, G. W. Fraser, M. Velliste, R. Kass, A. Schwartz",Proceedings of the National Academy of Sciences of the United States of America,2008-12-09,309,25,General BCI Methods and Systems,,10.1073/pnas.0808113105,,19047633,https://doi.org/10.1073/pnas.0808113105,https://www.semanticscholar.org/paper/0bfaaefcb8afe5431f1a22289aa4dec1b2d2c0cb,https://europepmc.org/articles/pmc2614787?pdf=render,Computer Science; Medicine,False,,non-invasive,Positions Functional network reorganization during learning in a brain-computer interface paradigm within General BCI Methods and Systems.,high citation signal (309); influential citation signal (25); recognized venue,"Broad BCI system claims often need stronger standardized evaluation across users, sessions, and devices.; Laboratory performance may not transfer to everyday usability, safety, and maintenance conditions.; Non-invasive signals are vulnerable to low signal-to-noise ratio, artifacts, and electrode setup variability.",BCI method,https://doi.org/10.1073/pnas.0808113105
2008,19,,19,192.66,citations=308; influential=17; recognized venue; BCI term matches=1; title BCI matches=1; open PDF metadata,c4877148c1d4e430e7fb2078fe3d5563bc7c8203,Comparative Analysis of Spectral Approaches to Feature Extraction for EEG-Based Motor Imagery Classification,"P. Herman, G. Prasad, T. Mcginnity, D. Coyle",IEEE transactions on neural systems and rehabilitation engineering,2008-06-03,308,17,Motor Imagery and Movement Decoding,,10.1109/TNSRE.2008.926694,,18701380,https://doi.org/10.1109/tnsre.2008.926694,https://www.semanticscholar.org/paper/c4877148c1d4e430e7fb2078fe3d5563bc7c8203,,Computer Science; Engineering; Medicine,False,,non-invasive; SMR,Positions Comparative Analysis of Spectral Approaches to Feature Extraction for EEG-Based Motor Imagery Classification within Motor Imagery and Movement Decoding.,high citation signal (308); influential citation signal (17); recognized venue,"SMR and movement decoders often need subject-specific calibration and may drift across sessions.; Offline motor-imagery accuracy may not translate to reliable continuous control or rehabilitation gains.; Non-invasive signals are vulnerable to low signal-to-noise ratio, artifacts, and electrode setup variability.",BCI method,https://doi.org/10.1109/tnsre.2008.926694
